No.,Time,Source,Destination,Protocol,Length,Info
1,0,VMware_c0:00:08,Broadcast,ARP,60,Who has 192.168.149.2? Tell 192.168.149.1
2,1.140996308,VMware_c0:00:08,Broadcast,ARP,60,Who has 192.168.149.2? Tell 192.168.149.1
3,2.002342422,VMware_c0:00:08,Broadcast,ARP,60,Who has 192.168.149.2? Tell 192.168.149.1
4,3.000861635,VMware_c0:00:08,Broadcast,ARP,60,Who has 192.168.149.2? Tell 192.168.149.1
5,5.183159849,142.250.192.46,192.168.149.2,DNS,88,Standard query 0x5845 A contile.services.mozilla.com
6,5.183341077,142.250.192.46,192.168.149.2,DNS,88,Standard query 0x4447 AAAA contile.services.mozilla.com
7,5.478974283,142.250.192.46,192.168.149.2,DNS,95,Standard query 0xed23 A content-signature-2.cdn.mozilla.net
8,5.479037574,142.250.192.46,192.168.149.2,DNS,95,Standard query 0xe426 AAAA content-signature-2.cdn.mozilla.net
9,5.583190725,192.168.149.2,142.250.192.46,DNS,104,Standard query response 0x5845 A contile.services.mozilla.com A 34.117.237.239
10,5.5831911,192.168.149.2,142.250.192.46,DNS,169,Standard query response 0x4447 AAAA contile.services.mozilla.com SOA ns-679.awsdns-20.net
11,5.584206231,142.250.192.46,34.117.237.239,TCP,74,50890  >  443 [SYN] Seq=0 Win=64240 Len=0 MSS=1460 SACK_PERM TSval=4006347968 TSecr=0 WS=128
12,5.652639814,192.168.149.1,239.255.255.250,SSDP,217,M-SEARCH * HTTP/1.1 
13,5.807179048,34.117.237.239,142.250.192.46,TCP,60,"443  >  50890 [SYN, ACK] Seq=0 Ack=1 Win=64240 Len=0 MSS=1460"
14,5.807368112,142.250.192.46,34.117.237.239,TCP,54,50890  >  443 [ACK] Seq=1 Ack=1 Win=64240 Len=0
15,5.814290477,142.250.192.46,34.117.237.239,TLSv1.3,571,Client Hello
16,5.814606692,34.117.237.239,142.250.192.46,TCP,60,443  >  50890 [ACK] Seq=1 Ack=518 Win=64240 Len=0
17,5.859971563,192.168.149.2,142.250.192.46,DNS,261,Standard query response 0xe426 AAAA content-signature-2.cdn.mozilla.net CNAME content-signature-chains.prod.autograph.services.mozaws.net CNAME prod.content-signature-chains.prod.webservices.mozgcp.net AAAA 2600:1901:0:92a9::
18,5.859971879,192.168.149.2,142.250.192.46,DNS,249,Standard query response 0xed23 A content-signature-2.cdn.mozilla.net CNAME content-signature-chains.prod.autograph.services.mozaws.net CNAME prod.content-signature-chains.prod.webservices.mozgcp.net A 34.160.144.191
19,5.871870001,142.250.192.46,34.160.144.191,TCP,74,60436  >  443 [SYN] Seq=0 Win=64240 Len=0 MSS=1460 SACK_PERM TSval=4125080567 TSecr=0 WS=128
20,5.879231704,34.160.144.191,142.250.192.46,TCP,60,"443  >  60436 [SYN, ACK] Seq=0 Ack=1 Win=64240 Len=0 MSS=1460"
21,5.879321227,142.250.192.46,34.160.144.191,TCP,54,60436  >  443 [ACK] Seq=1 Ack=1 Win=64240 Len=0
22,5.879540425,142.250.192.46,34.160.144.191,TLSv1.2,270,Client Hello
23,5.879682089,34.160.144.191,142.250.192.46,TCP,60,443  >  60436 [ACK] Seq=1 Ack=217 Win=64240 Len=0
24,5.960638561,34.117.237.239,142.250.192.46,TLSv1.3,2878,"Server Hello, Change Cipher Spec"
25,5.960710596,142.250.192.46,34.117.237.239,TCP,54,50890  >  443 [ACK] Seq=518 Ack=2825 Win=62780 Len=0
26,5.967408868,34.117.237.239,142.250.192.46,TLSv1.3,1804,Application Data
27,5.967429199,142.250.192.46,34.117.237.239,TCP,54,50890  >  443 [ACK] Seq=518 Ack=4575 Win=62780 Len=0
28,6.003861084,34.160.144.191,142.250.192.46,TLSv1.2,1466,Server Hello
29,6.003886799,142.250.192.46,34.160.144.191,TCP,54,60436  >  443 [ACK] Seq=217 Ack=1413 Win=63540 Len=0
30,6.003982867,34.160.144.191,142.250.192.46,TCP,1514,"443  >  60436 [PSH, ACK] Seq=1413 Ack=217 Win=64240 Len=1460 [TCP segment of a reassembled PDU]"
31,6.003998465,142.250.192.46,34.160.144.191,TCP,54,60436  >  443 [ACK] Seq=217 Ack=2873 Win=62780 Len=0
32,6.004286781,34.160.144.191,142.250.192.46,TLSv1.2,1639,"Certificate, Server Key Exchange, Server Hello Done"
33,6.004296498,142.250.192.46,34.160.144.191,TCP,54,60436  >  443 [ACK] Seq=217 Ack=4458 Win=62780 Len=0
34,6.00692015,142.250.192.46,34.160.144.191,TLSv1.2,147,"Client Key Exchange, Change Cipher Spec, Encrypted Handshake Message"
35,6.007207028,34.160.144.191,142.250.192.46,TCP,60,443  >  60436 [ACK] Seq=4458 Ack=310 Win=64240 Len=0
36,6.06423323,34.160.144.191,142.250.192.46,TLSv1.2,349,"New Session Ticket, Change Cipher Spec, Encrypted Handshake Message"
37,6.064804129,34.160.144.191,142.250.192.46,TLSv1.2,123,Application Data
38,6.105538234,142.250.192.46,34.160.144.191,TCP,54,60436  >  443 [ACK] Seq=310 Ack=4822 Win=62780 Len=0
39,6.156568618,142.250.192.46,192.168.149.2,DNS,74,Standard query 0x2da2 A r3.o.lencr.org
40,6.156733069,142.250.192.46,192.168.149.2,DNS,74,Standard query 0x42a0 AAAA r3.o.lencr.org
41,6.238678876,192.168.149.2,142.250.192.46,DNS,197,Standard query response 0x42a0 AAAA r3.o.lencr.org CNAME o.lencr.edgesuite.net CNAME a1887.dscq.akamai.net AAAA 2600:140f:2e00::6847:3d4a AAAA 2600:140f:2e00::6847:3d51
42,6.298829937,192.168.149.2,142.250.192.46,DNS,173,Standard query response 0x2da2 A r3.o.lencr.org CNAME o.lencr.edgesuite.net CNAME a1887.dscq.akamai.net A 23.48.226.75 A 23.48.226.43
43,6.299731894,142.250.192.46,23.48.226.75,TCP,74,59604  >  80 [SYN] Seq=0 Win=64240 Len=0 MSS=1460 SACK_PERM TSval=3583637072 TSecr=0 WS=128
44,6.299802494,142.250.192.46,23.48.226.75,TCP,74,59610  >  80 [SYN] Seq=0 Win=64240 Len=0 MSS=1460 SACK_PERM TSval=3583637072 TSecr=0 WS=128
45,6.306472029,23.48.226.75,142.250.192.46,TCP,60,"80  >  59604 [SYN, ACK] Seq=0 Ack=1 Win=64240 Len=0 MSS=1460"
46,6.306526103,142.250.192.46,23.48.226.75,TCP,54,59604  >  80 [ACK] Seq=1 Ack=1 Win=64240 Len=0
47,6.306880471,142.250.192.46,23.48.226.75,OCSP,469,Request
48,6.307024988,23.48.226.75,142.250.192.46,TCP,60,80  >  59604 [ACK] Seq=1 Ack=416 Win=64240 Len=0
49,6.311663673,23.48.226.75,142.250.192.46,TCP,60,"80  >  59610 [SYN, ACK] Seq=0 Ack=1 Win=64240 Len=0 MSS=1460"
50,6.311691913,142.250.192.46,23.48.226.75,TCP,54,59610  >  80 [ACK] Seq=1 Ack=1 Win=64240 Len=0
51,6.311954154,142.250.192.46,23.48.226.75,OCSP,469,Request
52,6.31210133,23.48.226.75,142.250.192.46,TCP,60,80  >  59610 [ACK] Seq=1 Ack=416 Win=64240 Len=0
53,6.394511059,142.250.192.46,192.168.149.2,DNS,85,Standard query 0x071f A push.services.mozilla.com
54,6.394587862,142.250.192.46,192.168.149.2,DNS,85,Standard query 0x0e1d AAAA push.services.mozilla.com
55,6.428301256,23.48.226.75,142.250.192.46,OCSP,981,Response
56,6.42832311,142.250.192.46,23.48.226.75,TCP,54,59604  >  80 [ACK] Seq=416 Ack=928 Win=63963 Len=0
57,6.446105982,142.250.192.46,34.160.144.191,TLSv1.2,231,Application Data
58,6.446287834,142.250.192.46,34.160.144.191,TLSv1.2,349,Application Data
59,6.446693444,142.250.192.46,34.160.144.191,TLSv1.2,92,Application Data
60,6.446810647,34.160.144.191,142.250.192.46,TCP,60,443  >  60436 [ACK] Seq=4822 Ack=487 Win=64240 Len=0
61,6.446810847,34.160.144.191,142.250.192.46,TCP,60,443  >  60436 [ACK] Seq=4822 Ack=782 Win=64240 Len=0
62,6.446874264,34.160.144.191,142.250.192.46,TCP,60,443  >  60436 [ACK] Seq=4822 Ack=820 Win=64240 Len=0
63,6.459365419,192.168.149.2,142.250.192.46,DNS,139,Standard query response 0x071f A push.services.mozilla.com CNAME autopush.prod.mozaws.net A 34.208.31.97
64,6.461423905,142.250.192.46,192.168.149.2,DNS,87,Standard query 0xae05 A safebrowsing.googleapis.com
65,6.46149938,142.250.192.46,192.168.149.2,DNS,87,Standard query 0x5003 AAAA safebrowsing.googleapis.com
66,6.462247834,192.168.149.2,142.250.192.46,DNS,205,Standard query response 0x0e1d AAAA push.services.mozilla.com CNAME autopush.prod.mozaws.net SOA ns-1260.awsdns-29.org
67,6.465785102,142.250.192.46,192.168.149.2,DNS,85,Standard query 0x492a A push.services.mozilla.com
68,6.465859668,142.250.192.46,192.168.149.2,DNS,85,Standard query 0x1f2c AAAA push.services.mozilla.com
69,6.469459917,23.48.226.75,142.250.192.46,OCSP,981,Response
70,6.469479675,142.250.192.46,23.48.226.75,TCP,54,59610  >  80 [ACK] Seq=416 Ack=928 Win=63963 Len=0
71,6.471925094,142.250.192.46,34.117.237.239,TLSv1.3,118,"Change Cipher Spec, Application Data"
72,6.472135637,34.117.237.239,142.250.192.46,TCP,60,443  >  50890 [ACK] Seq=4575 Ack=582 Win=64240 Len=0
73,6.472317037,142.250.192.46,34.117.237.239,TLSv1.3,224,Application Data
74,6.472378425,142.250.192.46,34.117.237.239,TLSv1.3,287,Application Data
75,6.472402067,34.117.237.239,142.250.192.46,TCP,60,443  >  50890 [ACK] Seq=4575 Ack=752 Win=64240 Len=0
76,6.47245793,34.117.237.239,142.250.192.46,TCP,60,443  >  50890 [ACK] Seq=4575 Ack=985 Win=64240 Len=0
77,6.503175234,34.160.144.191,142.250.192.46,TLSv1.2,92,Application Data
78,6.503246774,142.250.192.46,34.160.144.191,TCP,54,60436  >  443 [ACK] Seq=820 Ack=4860 Win=62780 Len=0
79,6.504868316,34.160.144.191,142.250.192.46,TLSv1.2,359,Application Data
80,6.504896422,142.250.192.46,34.160.144.191,TCP,54,60436  >  443 [ACK] Seq=820 Ack=5165 Win=62780 Len=0
81,6.5124404,34.160.144.191,142.250.192.46,TLSv1.2,1514,Application Data
82,6.51248801,142.250.192.46,34.160.144.191,TCP,54,60436  >  443 [ACK] Seq=820 Ack=6625 Win=62780 Len=0
83,6.512440635,34.160.144.191,142.250.192.46,TLSv1.2,1418,Application Data
84,6.512634365,142.250.192.46,34.160.144.191,TCP,54,60436  >  443 [ACK] Seq=820 Ack=7989 Win=62780 Len=0
85,6.512440682,34.160.144.191,142.250.192.46,TLSv1.2,1466,Application Data
86,6.51271403,142.250.192.46,34.160.144.191,TCP,54,60436  >  443 [ACK] Seq=820 Ack=9401 Win=61368 Len=0
87,6.514721535,34.160.144.191,142.250.192.46,TLSv1.2,1291,Application Data
88,6.514762027,142.250.192.46,34.160.144.191,TCP,54,60436  >  443 [ACK] Seq=820 Ack=10638 Win=62780 Len=0
89,6.516486677,34.160.144.191,142.250.192.46,TLSv1.2,100,Application Data
90,6.516498969,142.250.192.46,34.160.144.191,TCP,54,60436  >  443 [ACK] Seq=820 Ack=10684 Win=62780 Len=0
91,6.516730044,142.250.192.46,34.160.144.191,TLSv1.2,100,Application Data
92,6.516981003,34.160.144.191,142.250.192.46,TCP,60,443  >  60436 [ACK] Seq=10684 Ack=866 Win=64240 Len=0
93,6.518850529,34.117.237.239,142.250.192.46,TLSv1.3,640,"Application Data, Application Data"
94,6.518863037,142.250.192.46,34.117.237.239,TCP,54,50890  >  443 [ACK] Seq=985 Ack=5161 Win=62780 Len=0
95,6.51885069,192.168.149.2,142.250.192.46,DNS,139,Standard query response 0x492a A push.services.mozilla.com CNAME autopush.prod.mozaws.net A 52.39.96.8
96,6.519450544,142.250.192.46,34.117.237.239,TLSv1.3,85,Application Data
97,6.519711658,34.117.237.239,142.250.192.46,TCP,60,443  >  50890 [ACK] Seq=5161 Ack=1016 Win=64240 Len=0
98,6.521936902,192.168.149.2,142.250.192.46,DNS,205,Standard query response 0x1f2c AAAA push.services.mozilla.com CNAME autopush.prod.mozaws.net SOA ns-1260.awsdns-29.org
99,6.522626951,142.250.192.46,52.39.96.8,TCP,74,51756  >  443 [SYN] Seq=0 Win=64240 Len=0 MSS=1460 SACK_PERM TSval=2046444061 TSecr=0 WS=128
100,6.525167699,34.117.237.239,142.250.192.46,TLSv1.3,85,Application Data
101,6.525170746,52.39.96.8,142.250.192.46,TCP,60,"443  >  51756 [SYN, ACK] Seq=0 Ack=1 Win=64240 Len=0 MSS=1460"
102,6.525446243,142.250.192.46,52.39.96.8,TCP,54,51756  >  443 [ACK] Seq=1 Ack=1 Win=64240 Len=0
103,6.525170801,192.168.149.2,142.250.192.46,DNS,103,Standard query response 0xae05 A safebrowsing.googleapis.com A 172.217.167.42
104,6.531625843,142.250.192.46,52.39.96.8,TLSv1.2,571,Client Hello
105,6.532160281,52.39.96.8,142.250.192.46,TCP,60,443  >  51756 [ACK] Seq=1 Ack=518 Win=64240 Len=0
106,6.569563672,142.250.192.46,34.117.237.239,TCP,54,50890  >  443 [ACK] Seq=1016 Ack=5192 Win=62780 Len=0
107,6.595187006,192.168.149.2,142.250.192.46,DNS,115,Standard query response 0x5003 AAAA safebrowsing.googleapis.com AAAA 2404:6800:4002:80b::200a
108,6.595605155,142.250.192.46,172.217.167.42,TCP,74,52706  >  443 [SYN] Seq=0 Win=64240 Len=0 MSS=1460 SACK_PERM TSval=2341999484 TSecr=0 WS=128
109,6.599373129,172.217.167.42,142.250.192.46,TCP,60,"443  >  52706 [SYN, ACK] Seq=0 Ack=1 Win=64240 Len=0 MSS=1460"
110,6.599430325,142.250.192.46,172.217.167.42,TCP,54,52706  >  443 [ACK] Seq=1 Ack=1 Win=64240 Len=0
111,6.603141947,142.250.192.46,172.217.167.42,TLSv1.3,571,Client Hello
112,6.60354066,172.217.167.42,142.250.192.46,TCP,60,443  >  52706 [ACK] Seq=1 Ack=518 Win=64240 Len=0
113,6.655204755,142.250.192.46,192.168.149.2,DNS,97,Standard query 0x05d8 A firefox.settings.services.mozilla.com
114,6.655281048,142.250.192.46,192.168.149.2,DNS,97,Standard query 0x2dde AAAA firefox.settings.services.mozilla.com
115,6.661277434,192.168.149.1,239.255.255.250,SSDP,217,M-SEARCH * HTTP/1.1 
116,6.709629501,192.168.149.2,142.250.192.46,DNS,181,Standard query response 0x2dde AAAA firefox.settings.services.mozilla.com SOA ns-1627.awsdns-11.co.uk
117,6.714183356,192.168.149.2,142.250.192.46,DNS,113,Standard query response 0x05d8 A firefox.settings.services.mozilla.com A 34.102.187.140
118,6.723474057,34.117.237.239,142.250.192.46,TLSv1.3,1300,"Application Data, Application Data, Application Data, Application Data"
119,6.723501619,142.250.192.46,34.117.237.239,TCP,54,50890  >  443 [ACK] Seq=1016 Ack=6438 Win=62780 Len=0
120,6.735992332,142.250.192.46,34.117.237.239,TLSv1.3,93,Application Data
121,6.73671227,34.117.237.239,142.250.192.46,TCP,60,443  >  50890 [ACK] Seq=6438 Ack=1055 Win=64240 Len=0
122,6.792432186,172.217.167.42,142.250.192.46,TLSv1.3,4354,"Server Hello, Change Cipher Spec"
123,6.792457382,142.250.192.46,172.217.167.42,TCP,54,52706  >  443 [ACK] Seq=518 Ack=4301 Win=61320 Len=0
124,6.792750867,142.250.192.46,34.102.187.140,QUIC,1399,"Initial, DCID=d63edd61404429e1, SCID=ada950, PKN: 0, CRYPTO"
125,6.797950468,142.250.192.46,34.102.187.140,TCP,74,48986  >  443 [SYN] Seq=0 Win=64240 Len=0 MSS=1460 SACK_PERM TSval=841072497 TSecr=0 WS=128
126,6.798099667,142.250.192.46,34.102.187.140,TCP,74,49000  >  443 [SYN] Seq=0 Win=64240 Len=0 MSS=1460 SACK_PERM TSval=841072497 TSecr=0 WS=128
127,6.799287485,172.217.167.42,142.250.192.46,TLSv1.3,434,Application Data
128,6.799301745,142.250.192.46,172.217.167.42,TCP,54,52706  >  443 [ACK] Seq=518 Ack=4681 Win=62780 Len=0
129,6.805517062,34.102.187.140,142.250.192.46,TCP,60,"443  >  48986 [SYN, ACK] Seq=0 Ack=1 Win=64240 Len=0 MSS=1460"
130,6.805554037,142.250.192.46,34.102.187.140,TCP,54,48986  >  443 [ACK] Seq=1 Ack=1 Win=64240 Len=0
131,6.805517714,34.102.187.140,142.250.192.46,TCP,60,"443  >  49000 [SYN, ACK] Seq=0 Ack=1 Win=64240 Len=0 MSS=1460"
132,6.805648202,142.250.192.46,34.102.187.140,TCP,54,49000  >  443 [ACK] Seq=1 Ack=1 Win=64240 Len=0
133,6.831008953,142.250.192.46,34.102.187.140,TLSv1.3,571,Client Hello
134,6.831470248,34.102.187.140,142.250.192.46,TCP,60,443  >  49000 [ACK] Seq=1 Ack=518 Win=64240 Len=0
135,6.836366649,142.250.192.46,34.102.187.140,TLSv1.3,571,Client Hello
136,6.836592275,34.102.187.140,142.250.192.46,TCP,60,443  >  48986 [ACK] Seq=1 Ack=518 Win=64240 Len=0
137,6.864725802,34.102.187.140,142.250.192.46,QUIC,1399,"Handshake, DCID=ada950, SCID=d63edd61404429e1"
138,6.867095851,142.250.192.46,34.102.187.140,QUIC,129,"Handshake, DCID=d63edd61404429e1, SCID=ada950"
139,6.8675807,34.102.187.140,142.250.192.46,QUIC,1399,"Handshake, DCID=ada950, SCID=d63edd61404429e1"
140,6.86795196,142.250.192.46,34.102.187.140,QUIC,84,"Handshake, DCID=d63edd61404429e1, SCID=ada950"
141,6.875766654,34.102.187.140,142.250.192.46,QUIC,1204,"Protected Payload (KP0), DCID=ada950"
142,6.886270492,142.250.192.46,34.102.187.140,QUIC,85,"Handshake, DCID=d63edd61404429e1, SCID=ada950"
143,6.95422228,34.102.187.140,142.250.192.46,TLSv1.3,1434,"Server Hello, Change Cipher Spec"
144,6.954260469,142.250.192.46,34.102.187.140,TCP,54,49000  >  443 [ACK] Seq=518 Ack=1381 Win=63480 Len=0
145,6.955663721,34.102.187.140,142.250.192.46,TLSv1.3,2198,Application Data
146,6.955682689,142.250.192.46,34.102.187.140,TCP,54,49000  >  443 [ACK] Seq=518 Ack=3525 Win=61336 Len=0
147,6.967445454,34.102.187.140,142.250.192.46,TLSv1.3,1466,"Server Hello, Change Cipher Spec"
148,6.967490722,142.250.192.46,34.102.187.140,TCP,54,48986  >  443 [ACK] Seq=518 Ack=1413 Win=63540 Len=0
149,6.971981903,34.102.187.140,142.250.192.46,TLSv1.3,2166,Application Data
150,6.972000378,142.250.192.46,34.102.187.140,TCP,54,48986  >  443 [ACK] Seq=518 Ack=3525 Win=62780 Len=0
151,7.049573052,142.250.192.46,192.168.149.2,DNS,73,Standard query 0xe4dc A ocsp.pki.goog
152,7.049652611,142.250.192.46,192.168.149.2,DNS,73,Standard query 0xcad2 AAAA ocsp.pki.goog
153,7.065676873,142.250.192.46,192.168.149.2,DNS,77,Standard query 0xc4bb A ocsp.digicert.com
154,7.065733594,142.250.192.46,192.168.149.2,DNS,77,Standard query 0x00bf AAAA ocsp.digicert.com
155,7.089800261,52.39.96.8,142.250.192.46,TLSv1.2,1514,Server Hello
156,7.089879271,142.250.192.46,52.39.96.8,TCP,54,51756  >  443 [ACK] Seq=518 Ack=1461 Win=62780 Len=0
157,7.100893633,52.39.96.8,142.250.192.46,TLSv1.2,2100,"Certificate, Server Key Exchange, Server Hello Done"
158,7.100934916,142.250.192.46,52.39.96.8,TCP,54,51756  >  443 [ACK] Seq=518 Ack=3507 Win=62780 Len=0
159,7.115669449,142.250.192.46,52.39.96.8,TLSv1.2,180,"Client Key Exchange, Change Cipher Spec, Encrypted Handshake Message"
160,7.115880695,52.39.96.8,142.250.192.46,TCP,60,443  >  51756 [ACK] Seq=3507 Ack=644 Win=64240 Len=0
161,7.116421738,142.250.192.46,34.102.187.140,QUIC,82,"Handshake, DCID=d63edd61404429e1, SCID=ada950"
162,7.116737719,142.250.192.46,34.102.187.140,QUIC,82,"Handshake, DCID=d63edd61404429e1, SCID=ada950"
163,7.121964053,192.168.149.2,142.250.192.46,DNS,125,Standard query response 0xc4bb A ocsp.digicert.com CNAME cs9.wac.phicdn.net A 117.18.237.29
164,7.136763151,192.168.149.2,142.250.192.46,DNS,124,Standard query response 0xe4dc A ocsp.pki.goog CNAME pki-goog.l.google.com A 142.250.194.67
165,7.137433209,192.168.149.2,142.250.192.46,DNS,174,Standard query response 0x00bf AAAA ocsp.digicert.com CNAME cs9.wac.phicdn.net SOA ns1.edgecastcdn.net
166,7.138999131,142.250.192.46,117.18.237.29,TCP,74,58088  >  80 [SYN] Seq=0 Win=64240 Len=0 MSS=1460 SACK_PERM TSval=2430649145 TSecr=0 WS=128
167,7.139413834,142.250.192.46,117.18.237.29,TCP,74,58096  >  80 [SYN] Seq=0 Win=64240 Len=0 MSS=1460 SACK_PERM TSval=2430649146 TSecr=0 WS=128
168,7.139672658,142.250.192.46,117.18.237.29,TCP,74,58098  >  80 [SYN] Seq=0 Win=64240 Len=0 MSS=1460 SACK_PERM TSval=2430649146 TSecr=0 WS=128
169,7.143395726,117.18.237.29,142.250.192.46,TCP,60,"80  >  58088 [SYN, ACK] Seq=0 Ack=1 Win=64240 Len=0 MSS=1460"
170,7.143459687,142.250.192.46,117.18.237.29,TCP,54,58088  >  80 [ACK] Seq=1 Ack=1 Win=64240 Len=0
171,7.143396004,117.18.237.29,142.250.192.46,TCP,60,"80  >  58096 [SYN, ACK] Seq=0 Ack=1 Win=64240 Len=0 MSS=1460"
172,7.143510372,142.250.192.46,117.18.237.29,TCP,54,58096  >  80 [ACK] Seq=1 Ack=1 Win=64240 Len=0
173,7.143396085,117.18.237.29,142.250.192.46,TCP,60,"80  >  58098 [SYN, ACK] Seq=0 Ack=1 Win=64240 Len=0 MSS=1460"
174,7.143548798,142.250.192.46,117.18.237.29,TCP,54,58098  >  80 [ACK] Seq=1 Ack=1 Win=64240 Len=0
175,7.14396679,142.250.192.46,117.18.237.29,OCSP,470,Request
176,7.14421385,117.18.237.29,142.250.192.46,TCP,60,80  >  58088 [ACK] Seq=1 Ack=417 Win=64240 Len=0
177,7.144566423,142.250.192.46,117.18.237.29,OCSP,470,Request
178,7.144723264,117.18.237.29,142.250.192.46,TCP,60,80  >  58098 [ACK] Seq=1 Ack=417 Win=64240 Len=0
179,7.145216522,142.250.192.46,117.18.237.29,OCSP,470,Request
180,7.145394061,117.18.237.29,142.250.192.46,TCP,60,80  >  58096 [ACK] Seq=1 Ack=417 Win=64240 Len=0
181,7.201461699,34.102.187.140,142.250.192.46,QUIC,86,"Handshake, DCID=ada950, SCID=d63edd61404429e1"
182,7.219613433,142.250.192.46,117.18.237.29,TCP,74,58112  >  80 [SYN] Seq=0 Win=64240 Len=0 MSS=1460 SACK_PERM TSval=2430649226 TSecr=0 WS=128
183,7.223840006,117.18.237.29,142.250.192.46,TCP,60,"80  >  58112 [SYN, ACK] Seq=0 Ack=1 Win=64240 Len=0 MSS=1460"
184,7.223886892,142.250.192.46,117.18.237.29,TCP,54,58112  >  80 [ACK] Seq=1 Ack=1 Win=64240 Len=0
185,7.224501781,142.250.192.46,117.18.237.29,OCSP,470,Request
186,7.224671114,117.18.237.29,142.250.192.46,TCP,60,80  >  58112 [ACK] Seq=1 Ack=417 Win=64240 Len=0
187,7.238840943,192.168.149.2,142.250.192.46,DNS,136,Standard query response 0xcad2 AAAA ocsp.pki.goog CNAME pki-goog.l.google.com AAAA 2404:6800:4002:820::2003
188,7.239744703,142.250.192.46,142.250.194.67,TCP,74,38634  >  80 [SYN] Seq=0 Win=64240 Len=0 MSS=1460 SACK_PERM TSval=589274309 TSecr=0 WS=128
189,7.242472284,142.250.194.67,142.250.192.46,TCP,60,"80  >  38634 [SYN, ACK] Seq=0 Ack=1 Win=64240 Len=0 MSS=1460"
190,7.242502227,142.250.192.46,142.250.194.67,TCP,54,38634  >  80 [ACK] Seq=1 Ack=1 Win=64240 Len=0
191,7.2428731,142.250.192.46,142.250.194.67,OCSP,472,Request
192,7.243121964,142.250.194.67,142.250.192.46,TCP,60,80  >  38634 [ACK] Seq=1 Ack=419 Win=64240 Len=0
193,7.248066957,117.18.237.29,142.250.192.46,OCSP,915,Response
194,7.248101252,142.250.192.46,117.18.237.29,TCP,54,58098  >  80 [ACK] Seq=417 Ack=862 Win=63714 Len=0
195,7.258253975,117.18.237.29,142.250.192.46,OCSP,916,Response
196,7.258275609,142.250.192.46,117.18.237.29,TCP,54,58088  >  80 [ACK] Seq=417 Ack=863 Win=63788 Len=0
197,7.289129484,142.250.192.46,34.102.187.140,TLSv1.3,118,"Change Cipher Spec, Application Data"
198,7.289740429,34.102.187.140,142.250.192.46,TCP,60,443  >  48986 [ACK] Seq=3525 Ack=582 Win=64240 Len=0
199,7.2979645,142.250.192.46,34.102.187.140,TLSv1.3,224,Application Data
200,7.298108131,34.102.187.140,142.250.192.46,TCP,60,443  >  48986 [ACK] Seq=3525 Ack=752 Win=64240 Len=0
201,7.298492934,142.250.192.46,34.102.187.140,TLSv1.3,428,Application Data
202,7.29860134,34.102.187.140,142.250.192.46,TCP,60,443  >  48986 [ACK] Seq=3525 Ack=1126 Win=64240 Len=0
203,7.300844287,142.250.192.46,34.102.187.140,QUIC,152,"Protected Payload (KP0), DCID=d63edd61404429e1"
204,7.301021764,142.250.192.46,34.102.187.140,QUIC,108,"Protected Payload (KP0), DCID=d63edd61404429e1"
205,7.306600387,142.250.192.46,34.102.187.140,QUIC,347,"Protected Payload (KP0), DCID=d63edd61404429e1"
206,7.336697651,117.18.237.29,142.250.192.46,OCSP,916,Response
207,7.336719719,142.250.192.46,117.18.237.29,TCP,54,58112  >  80 [ACK] Seq=417 Ack=863 Win=63788 Len=0
208,7.345375851,142.250.192.46,192.168.149.2,DNS,95,Standard query 0xb514 A contile-images.services.mozilla.com
209,7.345455686,142.250.192.46,192.168.149.2,DNS,95,Standard query 0x5010 AAAA contile-images.services.mozilla.com
210,7.370756133,34.102.187.140,142.250.192.46,TLSv1.3,640,"Application Data, Application Data"
211,7.370780016,142.250.192.46,34.102.187.140,TCP,54,48986  >  443 [ACK] Seq=1126 Ack=4111 Win=62780 Len=0
212,7.371765021,142.250.192.46,34.102.187.140,TLSv1.3,85,Application Data
213,7.37213522,34.102.187.140,142.250.192.46,TCP,60,443  >  48986 [ACK] Seq=4111 Ack=1157 Win=64240 Len=0
214,7.372866308,34.102.187.140,142.250.192.46,QUIC,547,"Protected Payload (KP0), DCID=ada950"
215,7.372866468,34.102.187.140,142.250.192.46,QUIC,137,"Protected Payload (KP0), DCID=ada950"
216,7.373760003,142.250.192.46,34.102.187.140,QUIC,75,"Protected Payload (KP0), DCID=d63edd61404429e1"
217,7.384916191,34.102.187.140,142.250.192.46,TLSv1.3,85,Application Data
218,7.386805965,34.102.187.140,142.250.192.46,TLSv1.3,210,Application Data
219,7.386872249,142.250.192.46,34.102.187.140,TCP,54,48986  >  443 [ACK] Seq=1157 Ack=4298 Win=62780 Len=0
220,7.387099941,142.250.192.46,34.102.187.140,TLSv1.3,93,Application Data
221,7.3872576,34.102.187.140,142.250.192.46,TCP,60,443  >  48986 [ACK] Seq=4298 Ack=1196 Win=64240 Len=0
222,7.390791183,34.102.187.140,142.250.192.46,QUIC,72,"Protected Payload (KP0), DCID=ada950"
223,7.390791544,34.102.187.140,142.250.192.46,QUIC,700,"Protected Payload (KP0), DCID=ada950"
224,7.39179612,142.250.192.46,34.102.187.140,QUIC,79,"Protected Payload (KP0), DCID=d63edd61404429e1"
225,7.398145273,192.168.149.2,142.250.192.46,DNS,111,Standard query response 0xb514 A contile-images.services.mozilla.com A 34.120.115.102
226,7.398662858,192.168.149.2,142.250.192.46,DNS,176,Standard query response 0x5010 AAAA contile-images.services.mozilla.com SOA ns-679.awsdns-20.net
227,7.399294815,142.250.192.46,34.120.115.102,TCP,74,42686  >  443 [SYN] Seq=0 Win=64240 Len=0 MSS=1460 SACK_PERM TSval=2037149514 TSecr=0 WS=128
228,7.399499293,142.250.192.46,34.120.115.102,TCP,74,42702  >  443 [SYN] Seq=0 Win=64240 Len=0 MSS=1460 SACK_PERM TSval=2037149515 TSecr=0 WS=128
229,7.404228425,34.120.115.102,142.250.192.46,TCP,60,"443  >  42686 [SYN, ACK] Seq=0 Ack=1 Win=64240 Len=0 MSS=1460"
230,7.404259341,142.250.192.46,34.120.115.102,TCP,54,42686  >  443 [ACK] Seq=1 Ack=1 Win=64240 Len=0
231,7.404228725,34.120.115.102,142.250.192.46,TCP,60,"443  >  42702 [SYN, ACK] Seq=0 Ack=1 Win=64240 Len=0 MSS=1460"
232,7.404329895,142.250.192.46,34.120.115.102,TCP,54,42702  >  443 [ACK] Seq=1 Ack=1 Win=64240 Len=0
233,7.408409128,142.250.192.46,34.120.115.102,TLSv1.3,571,Client Hello
234,7.408924747,34.120.115.102,142.250.192.46,TCP,60,443  >  42702 [ACK] Seq=1 Ack=518 Win=64240 Len=0
235,7.413991651,142.250.192.46,34.120.115.102,TLSv1.3,571,Client Hello
236,7.414332451,34.120.115.102,142.250.192.46,TCP,60,443  >  42686 [ACK] Seq=1 Ack=518 Win=64240 Len=0
237,7.418107644,52.39.96.8,142.250.192.46,TLSv1.2,105,"Change Cipher Spec, Encrypted Handshake Message"
238,7.418603187,142.250.192.46,52.39.96.8,TLSv1.2,681,Application Data
239,7.418863247,52.39.96.8,142.250.192.46,TCP,60,443  >  51756 [ACK] Seq=3558 Ack=1271 Win=64240 Len=0
240,7.427444226,142.250.194.67,142.250.192.46,OCSP,818,Response
241,7.427477222,142.250.192.46,142.250.194.67,TCP,54,38634  >  80 [ACK] Seq=419 Ack=765 Win=63476 Len=0
242,7.438216408,142.250.192.46,172.217.167.42,TLSv1.3,118,"Change Cipher Spec, Application Data"
243,7.43851452,172.217.167.42,142.250.192.46,TCP,60,443  >  52706 [ACK] Seq=4681 Ack=582 Win=64240 Len=0
244,7.439632009,142.250.192.46,172.217.167.42,TLSv1.3,224,Application Data
245,7.439808591,142.250.192.46,172.217.167.42,TLSv1.3,663,Application Data
246,7.439973493,172.217.167.42,142.250.192.46,TCP,60,443  >  52706 [ACK] Seq=4681 Ack=752 Win=64240 Len=0
247,7.439973673,172.217.167.42,142.250.192.46,TCP,60,443  >  52706 [ACK] Seq=4681 Ack=1361 Win=64240 Len=0
248,7.476820571,34.102.187.140,142.250.192.46,QUIC,70,"Protected Payload (KP0), DCID=ada950"
249,7.497974029,172.217.167.42,142.250.192.46,TLSv1.3,668,"Application Data, Application Data"
250,7.497994911,142.250.192.46,172.217.167.42,TCP,54,52706  >  443 [ACK] Seq=1361 Ack=5295 Win=62780 Len=0
251,7.498774734,142.250.192.46,172.217.167.42,TLSv1.3,85,Application Data
252,7.498983569,172.217.167.42,142.250.192.46,TCP,60,443  >  52706 [ACK] Seq=5295 Ack=1392 Win=64240 Len=0
253,7.50839147,172.217.167.42,142.250.192.46,TLSv1.3,85,Application Data
254,7.522782586,34.120.115.102,142.250.192.46,TLSv1.3,4593,"Server Hello, Change Cipher Spec, Application Data"
255,7.52285216,142.250.192.46,34.120.115.102,TCP,54,42702  >  443 [ACK] Seq=518 Ack=4540 Win=61320 Len=0
256,7.529555964,34.120.115.102,142.250.192.46,TLSv1.3,1466,"Server Hello, Change Cipher Spec"
257,7.529599124,142.250.192.46,34.120.115.102,TCP,54,42686  >  443 [ACK] Seq=518 Ack=1413 Win=63540 Len=0
258,7.53321693,34.120.115.102,142.250.192.46,TCP,2974,"443  >  42686 [PSH, ACK] Seq=1413 Ack=518 Win=64240 Len=2920 [TCP segment of a reassembled PDU]"
259,7.533271938,142.250.192.46,34.120.115.102,TCP,54,42686  >  443 [ACK] Seq=518 Ack=4333 Win=62780 Len=0
260,7.536977515,142.250.192.46,23.48.226.75,OCSP,469,Request
261,7.537896705,23.48.226.75,142.250.192.46,TCP,60,80  >  59604 [ACK] Seq=928 Ack=831 Win=64240 Len=0
262,7.550118314,142.250.192.46,172.217.167.42,TCP,54,52706  >  443 [ACK] Seq=1392 Ack=5326 Win=62780 Len=0
263,7.555935854,34.120.115.102,142.250.192.46,TLSv1.3,261,Application Data
264,7.555971105,142.250.192.46,34.120.115.102,TCP,54,42686  >  443 [ACK] Seq=518 Ack=4540 Win=62780 Len=0
265,7.5631794,142.250.192.46,23.48.226.75,OCSP,469,Request
266,7.563385949,23.48.226.75,142.250.192.46,TCP,60,80  >  59610 [ACK] Seq=928 Ack=831 Win=64240 Len=0
267,7.616389493,172.217.167.42,142.250.192.46,TLSv1.3,382,Application Data
268,7.616422386,142.250.192.46,172.217.167.42,TCP,54,52706  >  443 [ACK] Seq=1392 Ack=5654 Win=62780 Len=0
269,7.617470032,172.217.167.42,142.250.192.46,TLSv1.3,1434,Application Data
270,7.617503382,142.250.192.46,172.217.167.42,TCP,54,52706  >  443 [ACK] Seq=1392 Ack=7034 Win=62780 Len=0
271,7.622072416,172.217.167.42,142.250.192.46,TLSv1.3,2814,"Application Data, Application Data"
272,7.622089864,142.250.192.46,172.217.167.42,TCP,54,52706  >  443 [ACK] Seq=1392 Ack=9794 Win=62780 Len=0
273,7.647465757,172.217.167.42,142.250.192.46,TLSv1.3,1434,Application Data
274,7.647485511,142.250.192.46,172.217.167.42,TCP,54,52706  >  443 [ACK] Seq=1392 Ack=11174 Win=62780 Len=0
275,7.654183326,fe80::20c:29ff:feb0:abae,ff02::2,ICMPv6,62,Router Solicitation
276,7.660991343,172.217.167.42,142.250.192.46,TLSv1.3,1434,Application Data
277,7.661010308,142.250.192.46,172.217.167.42,TCP,54,52706  >  443 [ACK] Seq=1392 Ack=12554 Win=62780 Len=0
278,7.663952407,172.217.167.42,142.250.192.46,TLSv1.3,1434,Application Data
279,7.6639653,142.250.192.46,172.217.167.42,TCP,54,52706  >  443 [ACK] Seq=1392 Ack=13934 Win=62780 Len=0
280,7.668678567,192.168.149.1,239.255.255.250,SSDP,217,M-SEARCH * HTTP/1.1 
281,7.676225167,172.217.167.42,142.250.192.46,TLSv1.3,1434,Application Data
282,7.67627425,142.250.192.46,172.217.167.42,TCP,54,52706  >  443 [ACK] Seq=1392 Ack=15314 Win=62780 Len=0
283,7.686989424,172.217.167.42,142.250.192.46,TLSv1.3,1434,Application Data
284,7.687007893,142.250.192.46,172.217.167.42,TCP,54,52706  >  443 [ACK] Seq=1392 Ack=16694 Win=62780 Len=0
285,7.697266356,172.217.167.42,142.250.192.46,TLSv1.3,1434,Application Data
286,7.697284452,142.250.192.46,172.217.167.42,TCP,54,52706  >  443 [ACK] Seq=1392 Ack=18074 Win=62780 Len=0
287,7.709207497,52.39.96.8,142.250.192.46,TLSv1.2,212,Application Data
288,7.709761683,172.217.167.42,142.250.192.46,TLSv1.3,2974,"Application Data, Application Data"
289,7.709776783,142.250.192.46,172.217.167.42,TCP,54,52706  >  443 [ACK] Seq=1392 Ack=20994 Win=62780 Len=0
290,7.717691179,142.250.192.46,52.39.96.8,TLSv1.2,200,Application Data
291,7.717925233,52.39.96.8,142.250.192.46,TCP,60,443  >  51756 [ACK] Seq=3716 Ack=1417 Win=64240 Len=0
292,7.733829,172.217.167.42,142.250.192.46,TLSv1.3,463,Application Data
293,7.73384751,142.250.192.46,172.217.167.42,TCP,54,52706  >  443 [ACK] Seq=1392 Ack=21403 Win=62780 Len=0
294,7.742561455,172.217.167.42,142.250.192.46,TLSv1.3,1434,Application Data
295,7.742580911,142.250.192.46,172.217.167.42,TCP,54,52706  >  443 [ACK] Seq=1392 Ack=22783 Win=62780 Len=0
296,7.753302332,23.48.226.75,142.250.192.46,OCSP,981,Response
297,7.753331662,142.250.192.46,23.48.226.75,TCP,54,59604  >  80 [ACK] Seq=831 Ack=1855 Win=63963 Len=0
298,7.754584217,142.250.192.46,34.120.115.102,TLSv1.3,118,"Change Cipher Spec, Application Data"
299,7.754774014,34.120.115.102,142.250.192.46,TCP,60,443  >  42702 [ACK] Seq=4540 Ack=582 Win=64240 Len=0
300,7.755056345,142.250.192.46,34.120.115.102,TLSv1.3,224,Application Data
301,7.755122524,142.250.192.46,34.120.115.102,TLSv1.3,396,Application Data
302,7.755126952,34.120.115.102,142.250.192.46,TCP,60,443  >  42702 [ACK] Seq=4540 Ack=752 Win=64240 Len=0
303,7.755224344,34.120.115.102,142.250.192.46,TCP,60,443  >  42702 [ACK] Seq=4540 Ack=1094 Win=64240 Len=0
304,7.755593544,172.217.167.42,142.250.192.46,TLSv1.3,1434,Application Data
305,7.755601731,142.250.192.46,172.217.167.42,TCP,54,52706  >  443 [ACK] Seq=1392 Ack=24163 Win=62780 Len=0
306,7.770213111,172.217.167.42,142.250.192.46,TLSv1.3,1434,Application Data
307,7.774978369,23.48.226.75,142.250.192.46,OCSP,981,Response
308,7.774995912,142.250.192.46,23.48.226.75,TCP,54,59610  >  80 [ACK] Seq=831 Ack=1855 Win=63963 Len=0
309,7.777275736,172.217.167.42,142.250.192.46,TLSv1.3,1434,Application Data
310,7.777289705,142.250.192.46,172.217.167.42,TCP,54,52706  >  443 [ACK] Seq=1392 Ack=26923 Win=62780 Len=0
311,7.778213161,142.250.192.46,34.120.115.102,TLSv1.3,118,"Change Cipher Spec, Application Data"
312,7.778415655,34.120.115.102,142.250.192.46,TCP,60,443  >  42686 [ACK] Seq=4540 Ack=582 Win=64240 Len=0
313,7.778670544,142.250.192.46,34.120.115.102,TLSv1.3,241,Application Data
314,7.778845528,34.120.115.102,142.250.192.46,TCP,60,443  >  42686 [ACK] Seq=4540 Ack=769 Win=64240 Len=0
315,7.778966786,142.250.192.46,34.120.115.102,TLSv1.3,212,Application Data
316,7.779129938,34.120.115.102,142.250.192.46,TCP,60,443  >  42702 [ACK] Seq=4540 Ack=1252 Win=64240 Len=0
317,7.796079304,172.217.167.42,142.250.192.46,TLSv1.3,1434,Application Data
318,7.799143959,172.217.167.42,142.250.192.46,TLSv1.3,1434,Application Data
319,7.799160351,142.250.192.46,172.217.167.42,TCP,54,52706  >  443 [ACK] Seq=1392 Ack=29683 Win=62780 Len=0
320,7.816341759,172.217.167.42,142.250.192.46,TLSv1.3,1434,Application Data
321,7.825140607,34.120.115.102,142.250.192.46,TLSv1.3,640,"Application Data, Application Data"
322,7.825178871,142.250.192.46,34.120.115.102,TCP,54,42702  >  443 [ACK] Seq=1252 Ack=5126 Win=62780 Len=0
323,7.827654107,142.250.192.46,34.120.115.102,TLSv1.3,85,Application Data
324,7.827948235,34.120.115.102,142.250.192.46,TCP,60,443  >  42702 [ACK] Seq=5126 Ack=1283 Win=64240 Len=0
325,7.829198739,34.120.115.102,142.250.192.46,TLSv1.3,224,"Application Data, Application Data"
326,7.829198882,172.217.167.42,142.250.192.46,TLSv1.3,1434,Application Data
327,7.829216599,142.250.192.46,172.217.167.42,TCP,54,52706  >  443 [ACK] Seq=1392 Ack=32443 Win=62780 Len=0
328,7.830277547,142.250.192.46,34.120.115.102,TLSv1.3,93,Application Data
329,7.830354975,34.120.115.102,142.250.192.46,TCP,60,443  >  42702 [ACK] Seq=5296 Ack=1322 Win=64240 Len=0
330,7.831388135,172.217.167.42,142.250.192.46,TLSv1.3,1434,Application Data
331,7.843204215,34.120.115.102,142.250.192.46,TLSv1.3,640,"Application Data, Application Data"
332,7.843219587,142.250.192.46,34.120.115.102,TCP,54,42686  >  443 [ACK] Seq=769 Ack=5126 Win=62780 Len=0
333,7.843935493,142.250.192.46,34.120.115.102,TLSv1.3,78,Application Data
334,7.844006392,142.250.192.46,34.120.115.102,TCP,54,"42686  >  443 [FIN, ACK] Seq=793 Ack=5126 Win=62780 Len=0"
335,7.844063615,34.120.115.102,142.250.192.46,TCP,60,443  >  42686 [ACK] Seq=5126 Ack=793 Win=64240 Len=0
336,7.84406373,172.217.167.42,142.250.192.46,TLSv1.3,1434,Application Data
337,7.844071786,142.250.192.46,172.217.167.42,TCP,54,52706  >  443 [ACK] Seq=1392 Ack=35203 Win=62780 Len=0
338,7.844125018,34.120.115.102,142.250.192.46,TCP,60,443  >  42686 [ACK] Seq=5126 Ack=794 Win=64239 Len=0
339,7.856157464,34.120.115.102,142.250.192.46,TLSv1.3,146,Application Data
340,7.8561577,34.120.115.102,142.250.192.46,TCP,60,"443  >  42686 [FIN, PSH, ACK] Seq=5126 Ack=794 Win=64239 Len=0"
341,7.856186978,142.250.192.46,34.120.115.102,TCP,54,42686  >  443 [ACK] Seq=794 Ack=5127 Win=62780 Len=0
342,7.85615773,172.217.167.42,142.250.192.46,TLSv1.3,1434,Application Data
343,7.866842191,172.217.167.42,142.250.192.46,TLSv1.3,1434,Application Data
344,7.866860259,142.250.192.46,172.217.167.42,TCP,54,52706  >  443 [ACK] Seq=1392 Ack=37963 Win=62780 Len=0
345,7.877864152,172.217.167.42,142.250.192.46,TLSv1.3,173,Application Data
346,7.878059927,142.250.192.46,172.217.167.42,TCP,54,52706  >  443 [ACK] Seq=1392 Ack=38082 Win=62780 Len=0
347,7.879872415,172.217.167.42,142.250.192.46,TLSv1.3,1434,Application Data
348,7.890841436,172.217.167.42,142.250.192.46,TLSv1.3,1434,Application Data
349,7.890870626,142.250.192.46,172.217.167.42,TCP,54,52706  >  443 [ACK] Seq=1392 Ack=40842 Win=62780 Len=0
350,7.897506154,142.250.192.46,34.120.115.102,TCP,54,42702  >  443 [ACK] Seq=1322 Ack=5388 Win=62780 Len=0
351,7.901660651,172.217.167.42,142.250.192.46,TLSv1.3,1434,Application Data
352,7.913848388,172.217.167.42,142.250.192.46,TLSv1.3,1434,Application Data
353,7.913869919,142.250.192.46,172.217.167.42,TCP,54,52706  >  443 [ACK] Seq=1392 Ack=43602 Win=62780 Len=0
354,7.924550751,172.217.167.42,142.250.192.46,TLSv1.3,1434,Application Data
355,7.934803075,172.217.167.42,142.250.192.46,TLSv1.3,1434,Application Data
356,7.934822574,142.250.192.46,172.217.167.42,TCP,54,52706  >  443 [ACK] Seq=1392 Ack=46362 Win=62780 Len=0
357,7.946041833,172.217.167.42,142.250.192.46,TLSv1.3,1434,Application Data
358,7.957251426,172.217.167.42,142.250.192.46,TLSv1.3,1434,Application Data
359,7.957272497,142.250.192.46,172.217.167.42,TCP,54,52706  >  443 [ACK] Seq=1392 Ack=49122 Win=62780 Len=0
360,7.974237188,172.217.167.42,142.250.192.46,TLSv1.3,1434,Application Data
361,7.979285557,172.217.167.42,142.250.192.46,TLSv1.3,1434,Application Data
362,7.979304799,142.250.192.46,172.217.167.42,TCP,54,52706  >  443 [ACK] Seq=1392 Ack=51882 Win=62780 Len=0
363,7.990511753,172.217.167.42,142.250.192.46,TLSv1.3,1434,Application Data
364,8.001715113,172.217.167.42,142.250.192.46,TLSv1.3,1434,Application Data
365,8.00174932,142.250.192.46,172.217.167.42,TCP,54,52706  >  443 [ACK] Seq=1392 Ack=54642 Win=62780 Len=0
366,8.009231676,52.39.96.8,142.250.192.46,TLSv1.2,253,Application Data
367,8.009232224,172.217.167.42,142.250.192.46,TLSv1.3,1553,"Application Data, Application Data"
368,8.009325446,142.250.192.46,172.217.167.42,TCP,54,52706  >  443 [ACK] Seq=1392 Ack=56141 Win=62780 Len=0
369,8.021605193,172.217.167.42,142.250.192.46,TLSv1.3,1434,Application Data
370,8.02174337,142.250.192.46,172.217.167.42,TCP,54,52706  >  443 [ACK] Seq=1392 Ack=57521 Win=62780 Len=0
371,8.023609719,172.217.167.42,142.250.192.46,TLSv1.3,1434,Application Data
372,8.042281135,172.217.167.42,142.250.192.46,TLSv1.3,2814,"Application Data, Application Data"
373,8.042383025,142.250.192.46,172.217.167.42,TCP,54,52706  >  443 [ACK] Seq=1392 Ack=61661 Win=62780 Len=0
374,8.049202465,172.217.167.42,142.250.192.46,TLSv1.3,1434,Application Data
375,8.049280471,142.250.192.46,172.217.167.42,TCP,54,52706  >  443 [ACK] Seq=1392 Ack=63041 Win=62780 Len=0
376,8.049781699,142.250.192.46,52.39.96.8,TCP,54,51756  >  443 [ACK] Seq=1417 Ack=3915 Win=62780 Len=0
377,8.052435254,172.217.167.42,142.250.192.46,TLSv1.3,983,"Application Data, Application Data"
378,8.052580211,142.250.192.46,172.217.167.42,TLSv1.3,93,Application Data
379,8.052861104,172.217.167.42,142.250.192.46,TCP,60,443  >  52706 [ACK] Seq=63970 Ack=1431 Win=64240 Len=0
380,8.053177744,142.250.192.46,172.217.167.42,TLSv1.3,78,Application Data
381,8.053239735,142.250.192.46,172.217.167.42,TCP,54,"52706  >  443 [FIN, ACK] Seq=1455 Ack=63970 Win=62780 Len=0"
382,8.053281125,172.217.167.42,142.250.192.46,TCP,60,443  >  52706 [ACK] Seq=63970 Ack=1455 Win=64240 Len=0
383,8.053430832,172.217.167.42,142.250.192.46,TCP,60,443  >  52706 [ACK] Seq=63970 Ack=1456 Win=64239 Len=0
384,8.057696364,142.250.192.46,34.102.187.140,TCP,74,49010  >  443 [SYN] Seq=0 Win=64240 Len=0 MSS=1460 SACK_PERM TSval=841073757 TSecr=0 WS=128
385,8.067569308,172.217.167.42,142.250.192.46,TCP,60,"443  >  52706 [FIN, PSH, ACK] Seq=63970 Ack=1456 Win=64239 Len=0"
386,8.067591516,142.250.192.46,172.217.167.42,TCP,54,52706  >  443 [ACK] Seq=1456 Ack=63971 Win=62780 Len=0
387,8.067569732,34.102.187.140,142.250.192.46,TCP,60,"443  >  49010 [SYN, ACK] Seq=0 Ack=1 Win=64240 Len=0 MSS=1460"
388,8.067667064,142.250.192.46,34.102.187.140,TCP,54,49010  >  443 [ACK] Seq=1 Ack=1 Win=64240 Len=0
389,8.067995893,142.250.192.46,34.102.187.140,TLSv1.2,272,Client Hello
390,8.068320671,34.102.187.140,142.250.192.46,TCP,60,443  >  49010 [ACK] Seq=1 Ack=219 Win=64240 Len=0
391,8.186493598,34.102.187.140,142.250.192.46,TLSv1.2,1514,Server Hello
392,8.186526137,142.250.192.46,34.102.187.140,TCP,54,49010  >  443 [ACK] Seq=219 Ack=1461 Win=62780 Len=0
393,8.186664709,34.102.187.140,142.250.192.46,TCP,1418,"443  >  49010 [PSH, ACK] Seq=1461 Ack=219 Win=64240 Len=1364 [TCP segment of a reassembled PDU]"
394,8.18668042,142.250.192.46,34.102.187.140,TCP,54,49010  >  443 [ACK] Seq=219 Ack=2825 Win=62780 Len=0
395,8.189534637,34.102.187.140,142.250.192.46,TLSv1.2,675,"Certificate, Server Key Exchange, Server Hello Done"
396,8.189548384,142.250.192.46,34.102.187.140,TCP,54,49010  >  443 [ACK] Seq=219 Ack=3446 Win=62780 Len=0
397,8.190848065,142.250.192.46,34.102.187.140,TLSv1.2,147,"Client Key Exchange, Change Cipher Spec, Encrypted Handshake Message"
398,8.191071277,34.102.187.140,142.250.192.46,TCP,60,443  >  49010 [ACK] Seq=3446 Ack=312 Win=64240 Len=0
