"No.","Time","Source","Destination","Protocol","Length","Info"
"1","0.000000","2600:1901:0:38d7::","2409:4089:2d0a:d410:19ac:9552:3acb:fb4b","TCP","86","80  >  55739 [ACK] Seq=1 Ack=1 Win=261 Len=0 SLE=0 SRE=1"
"2","0.012001","2600:1901:0:e988::","2409:4089:2d0a:d410:19ac:9552:3acb:fb4b","TCP","74","443  >  55750 [ACK] Seq=1 Ack=1 Win=340 Len=0"
"3","0.012001","2600:1901:0:e988::","2409:4089:2d0a:d410:19ac:9552:3acb:fb4b","TLSv1.2","159","Application Data"
"4","0.012329","2409:4089:2d0a:d410:19ac:9552:3acb:fb4b","2600:1901:0:e988::","TLSv1.2","113","Application Data"
"5","0.052468","192.168.144.139","34.107.221.82","HTTP","55","Continuation"
"6","0.107716","2600:1901:0:e988::","2409:4089:2d0a:d410:19ac:9552:3acb:fb4b","TCP","74","443  >  55750 [ACK] Seq=86 Ack=40 Win=340 Len=0"
"7","0.116233","2409:4089:2d0a:d410:19ac:9552:3acb:fb4b","2600:1901:0:38d7::","HTTP","75","Continuation"
"8","0.140781","34.107.221.82","192.168.144.139","TCP","66","80  >  55742 [ACK] Seq=1 Ack=2 Win=261 Len=0 SLE=1 SRE=2"
"9","0.204926","2600:1901:0:38d7::","2409:4089:2d0a:d410:19ac:9552:3acb:fb4b","TCP","86","80  >  55743 [ACK] Seq=1 Ack=2 Win=261 Len=0 SLE=1 SRE=2"
"10","0.665603","2409:4089:2d0a:d410:19ac:9552:3acb:fb4b","2405:200:1630:a0b::312c:c4b3","TCP","75","55746  >  80 [ACK] Seq=1 Ack=1 Win=510 Len=1"
"11","0.762196","2405:200:1630:a0b::312c:c4b3","2409:4089:2d0a:d410:19ac:9552:3acb:fb4b","TCP","86","80  >  55746 [ACK] Seq=1 Ack=2 Win=501 Len=0 SLE=1 SRE=2"
"12","1.026283","2409:4089:2d0a:d410:19ac:9552:3acb:fb4b","2404:6800:4009:80a::2003","TCP","75","55762  >  80 [ACK] Seq=1 Ack=1 Win=511 Len=1"
"13","1.160937","2404:6800:4009:80a::2003","2409:4089:2d0a:d410:19ac:9552:3acb:fb4b","TCP","86","80  >  55762 [ACK] Seq=1 Ack=2 Win=261 Len=0 SLE=1 SRE=2"
"14","1.196739","2409:4089:2d0a:d410:19ac:9552:3acb:fb4b","64:ff9b::98c3:264c","TCP","75","55768  >  80 [ACK] Seq=1 Ack=1 Win=510 Len=1"
"15","1.196739","2409:4089:2d0a:d410:19ac:9552:3acb:fb4b","64:ff9b::98c3:264c","TCP","75","55769  >  80 [ACK] Seq=1 Ack=1 Win=510 Len=1"
"16","1.278130","2409:4089:2d0a:d410:19ac:9552:3acb:fb4b","64:ff9b::98c3:264c","TCP","75","55765  >  80 [ACK] Seq=1 Ack=1 Win=513 Len=1"
"17","1.279754","64:ff9b::98c3:264c","2409:4089:2d0a:d410:19ac:9552:3acb:fb4b","TCP","86","80  >  55768 [ACK] Seq=1 Ack=2 Win=131 Len=0 SLE=1 SRE=2"
"18","1.287487","64:ff9b::98c3:264c","2409:4089:2d0a:d410:19ac:9552:3acb:fb4b","TCP","86","80  >  55769 [ACK] Seq=1 Ack=2 Win=131 Len=0 SLE=1 SRE=2"
"19","1.325312","2409:4089:2d0a:d410:19ac:9552:3acb:fb4b","2405:200:1630:a0b::312c:c4b3","TCP","75","55745  >  80 [ACK] Seq=1 Ack=1 Win=513 Len=1"
"20","1.379362","64:ff9b::98c3:264c","2409:4089:2d0a:d410:19ac:9552:3acb:fb4b","TCP","86","80  >  55765 [ACK] Seq=1 Ack=2 Win=133 Len=0 SLE=1 SRE=2"
"21","1.384378","2405:200:1630:a0b::312c:c4b3","2409:4089:2d0a:d410:19ac:9552:3acb:fb4b","TCP","86","80  >  55745 [ACK] Seq=1 Ack=2 Win=501 Len=0 SLE=1 SRE=2"
"22","1.470281","2404:6800:4002:825::2003","2409:4089:2d0a:d410:19ac:9552:3acb:fb4b","QUIC","1393","Handshake, DCID=5c4330, SCID=fa7a1cfca723a1ae"
"23","1.800093","2409:4089:2d0a:d410:19ac:9552:3acb:fb4b","2405:200:1630:a0b::312c:c4b3","TCP","75","55755  >  80 [ACK] Seq=1 Ack=1 Win=513 Len=1"
"24","1.921143","2405:200:1630:a0b::312c:c4b3","2409:4089:2d0a:d410:19ac:9552:3acb:fb4b","TCP","86","80  >  55755 [ACK] Seq=1 Ack=2 Win=501 Len=0 SLE=1 SRE=2"
"25","2.161360","2409:4089:2d0a:d410:19ac:9552:3acb:fb4b","2404:6800:4009:80a::2003","HTTP","75","Continuation"
"26","2.192694","2603:1046:c04:80f::2","2409:4089:2d0a:d410:19ac:9552:3acb:fb4b","TCP","86","443  >  55729 [SYN, ACK] Seq=0 Ack=1 Win=65535 Len=0 MSS=1370 WS=256 SACK_PERM"
"27","2.276233","2404:6800:4009:80a::2003","2409:4089:2d0a:d410:19ac:9552:3acb:fb4b","TCP","86","80  >  55773 [ACK] Seq=1 Ack=2 Win=261 Len=0 SLE=1 SRE=2"
"28","2.877755","192.168.144.139","192.168.144.105","DNS","76","Standard query 0x9f32 AAAA www.fatherly.com"
"29","2.940550","192.168.144.139","192.168.144.105","DNS","76","Standard query 0x9f32 AAAA www.fatherly.com"
"30","3.028117","192.168.144.105","192.168.144.139","DNS","188","Standard query response 0x9f32 AAAA www.fatherly.com AAAA 64:ff9b::36e6:414e AAAA 64:ff9b::36e6:417a AAAA 64:ff9b::36e6:4122 AAAA 64:ff9b::36e6:412b"
"31","3.029257","192.168.144.139","192.168.144.105","DNS","76","Standard query 0x9959 AAAA www.fatherly.com"
"32","3.034099","192.168.144.105","192.168.144.139","DNS","188","Standard query response 0x9959 AAAA www.fatherly.com AAAA 64:ff9b::36e6:412b AAAA 64:ff9b::36e6:4122 AAAA 64:ff9b::36e6:417a AAAA 64:ff9b::36e6:414e"
"33","5.193599","2404:6800:4002:82b::2005","2409:4089:2d0a:d410:19ac:9552:3acb:fb4b","TLSv1.2","1286","Application Data, Application Data, Application Data, Application Data, Application Data"
"34","6.425502","2404:6800:4002:82d::200e","2409:4089:2d0a:d410:19ac:9552:3acb:fb4b","UDP","86","443  >  55616 Len=24"
"35","7.453023","192.168.144.139","192.168.144.105","DNS","74","Standard query 0xeab2 AAAA www.google.com"
"36","7.525822","192.168.144.139","192.168.144.105","DNS","74","Standard query 0xeab2 AAAA www.google.com"
"37","7.537779","192.168.144.105","192.168.144.139","DNS","102","Standard query response 0xeab2 AAAA www.google.com AAAA 2404:6800:4009:81a::2004"
"38","7.538941","2409:4089:2d0a:d410:19ac:9552:3acb:fb4b","2404:6800:4009:81a::2004","TCP","86","55775  >  443 [SYN] Seq=0 Win=64952 Len=0 MSS=1412 WS=256 SACK_PERM"
"39","7.539141","192.168.144.139","192.168.144.105","DNS","74","Standard query 0xc923 AAAA www.google.com"
"40","7.543244","192.168.144.105","192.168.144.139","DNS","102","Standard query response 0xc923 AAAA www.google.com AAAA 2404:6800:4009:81a::2004"
"41","7.631861","2404:6800:4009:81a::2004","2409:4089:2d0a:d410:19ac:9552:3acb:fb4b","TCP","86","443  >  55775 [SYN, ACK] Seq=0 Ack=1 Win=65535 Len=0 MSS=1370 SACK_PERM WS=256"
"42","7.631929","2409:4089:2d0a:d410:19ac:9552:3acb:fb4b","2404:6800:4009:81a::2004","TCP","74","55775  >  443 [ACK] Seq=1 Ack=1 Win=131328 Len=0"
"43","7.634052","2409:4089:2d0a:d410:19ac:9552:3acb:fb4b","2404:6800:4009:81a::2004","TLSv1.3","591","Client Hello"
"44","7.733096","2404:6800:4009:81a::2004","2409:4089:2d0a:d410:19ac:9552:3acb:fb4b","TCP","74","443  >  55775 [ACK] Seq=1 Ack=518 Win=66816 Len=0"
"45","7.793181","2404:6800:4009:81a::2004","2409:4089:2d0a:d410:19ac:9552:3acb:fb4b","TLSv1.3","1294","Server Hello, Change Cipher Spec"
"46","7.799535","2404:6800:4009:81a::2004","2409:4089:2d0a:d410:19ac:9552:3acb:fb4b","TCP","1294","443  >  55775 [PSH, ACK] Seq=1221 Ack=518 Win=66816 Len=1220 [TCP segment of a reassembled PDU]"
"47","7.799535","2404:6800:4009:81a::2004","2409:4089:2d0a:d410:19ac:9552:3acb:fb4b","TCP","1294","443  >  55775 [ACK] Seq=2441 Ack=518 Win=66816 Len=1220 [TCP segment of a reassembled PDU]"
"48","7.799535","2404:6800:4009:81a::2004","2409:4089:2d0a:d410:19ac:9552:3acb:fb4b","TLSv1.3","702","Application Data"
"49","7.799616","2409:4089:2d0a:d410:19ac:9552:3acb:fb4b","2404:6800:4009:81a::2004","TCP","74","55775  >  443 [ACK] Seq=518 Ack=4289 Win=131328 Len=0"
"50","7.812088","2409:4089:2d0a:d410:19ac:9552:3acb:fb4b","2404:6800:4009:80a::2003","TCP","86","55776  >  80 [SYN] Seq=0 Win=64952 Len=0 MSS=1412 WS=256 SACK_PERM"
"51","7.936103","2404:6800:4009:80a::2003","2409:4089:2d0a:d410:19ac:9552:3acb:fb4b","TCP","86","80  >  55776 [SYN, ACK] Seq=0 Ack=1 Win=65535 Len=0 MSS=1370 SACK_PERM WS=256"
"52","7.936188","2409:4089:2d0a:d410:19ac:9552:3acb:fb4b","2404:6800:4009:80a::2003","TCP","74","55776  >  80 [ACK] Seq=1 Ack=1 Win=131328 Len=0"
"53","7.936697","2409:4089:2d0a:d410:19ac:9552:3acb:fb4b","2404:6800:4009:80a::2003","OCSP","502","Request"
"54","8.023761","5a:d5:a1:2d:26:23","AzureWav_1e:61:35","ARP","42","Who has 192.168.144.139? Tell 192.168.144.105"
"55","8.023777","AzureWav_1e:61:35","5a:d5:a1:2d:26:23","ARP","42","192.168.144.139 is at 2c:3b:70:1e:61:35"
"56","8.036921","2404:6800:4009:80a::2003","2409:4089:2d0a:d410:19ac:9552:3acb:fb4b","TCP","74","80  >  55776 [ACK] Seq=1 Ack=429 Win=66816 Len=0"
"57","8.064082","2409:4089:2d0a:d410:19ac:9552:3acb:fb4b","2404:6800:4009:81a::2004","TCP","74","55775  >  443 [FIN, ACK] Seq=518 Ack=4289 Win=131328 Len=0"
"58","8.101221","2404:6800:4009:80a::2003","2409:4089:2d0a:d410:19ac:9552:3acb:fb4b","OCSP","775","Response"
"59","8.157353","2409:4089:2d0a:d410:19ac:9552:3acb:fb4b","2404:6800:4009:80a::2003","TCP","74","55776  >  80 [ACK] Seq=429 Ack=702 Win=130816 Len=0"
"60","8.158035","2404:6800:4009:81a::2004","2409:4089:2d0a:d410:19ac:9552:3acb:fb4b","TCP","74","443  >  55775 [FIN, ACK] Seq=4289 Ack=519 Win=66816 Len=0"
"61","8.158083","2409:4089:2d0a:d410:19ac:9552:3acb:fb4b","2404:6800:4009:81a::2004","TCP","74","55775  >  443 [ACK] Seq=519 Ack=4290 Win=131328 Len=0"
"62","8.207261","2603:1046:c04:80f::2","2409:4089:2d0a:d410:19ac:9552:3acb:fb4b","TCP","74","443  >  55729 [RST] Seq=1 Win=0 Len=0"
"63","8.301065","2409:4089:2d0a:d410:19ac:9552:3acb:fb4b","2404:6800:4009:81a::2004","TCP","86","55777  >  443 [SYN] Seq=0 Win=64952 Len=0 MSS=1412 WS=256 SACK_PERM"
"64","8.425987","2404:6800:4009:81a::2004","2409:4089:2d0a:d410:19ac:9552:3acb:fb4b","TCP","86","443  >  55777 [SYN, ACK] Seq=0 Ack=1 Win=65535 Len=0 MSS=1370 SACK_PERM WS=256"
"65","8.426055","2409:4089:2d0a:d410:19ac:9552:3acb:fb4b","2404:6800:4009:81a::2004","TCP","74","55777  >  443 [ACK] Seq=1 Ack=1 Win=131328 Len=0"
"66","8.428072","2409:4089:2d0a:d410:19ac:9552:3acb:fb4b","2404:6800:4009:81a::2004","TLSv1.3","591","Client Hello"
"67","8.495686","2409:4089:2d0a:d410:19ac:9552:3acb:fb4b","2404:6800:4009:81a::2004","TCP","74","55777  >  443 [FIN, ACK] Seq=518 Ack=1 Win=131328 Len=0"
"68","8.549878","2404:6800:4009:81a::2004","2409:4089:2d0a:d410:19ac:9552:3acb:fb4b","TCP","74","443  >  55777 [ACK] Seq=1 Ack=518 Win=66816 Len=0"
"69","8.609088","2404:6800:4009:81a::2004","2409:4089:2d0a:d410:19ac:9552:3acb:fb4b","TCP","74","443  >  55777 [ACK] Seq=1 Ack=519 Win=66816 Len=0"
"70","8.614391","2404:6800:4009:81a::2004","2409:4089:2d0a:d410:19ac:9552:3acb:fb4b","TLSv1.3","1294","Server Hello, Change Cipher Spec"
"71","8.614391","2404:6800:4009:81a::2004","2409:4089:2d0a:d410:19ac:9552:3acb:fb4b","TCP","1294","443  >  55777 [PSH, ACK] Seq=1221 Ack=519 Win=66816 Len=1220 [TCP segment of a reassembled PDU]"
"72","8.614391","2404:6800:4009:81a::2004","2409:4089:2d0a:d410:19ac:9552:3acb:fb4b","TCP","1294","443  >  55777 [ACK] Seq=2441 Ack=519 Win=66816 Len=1220 [TCP segment of a reassembled PDU]"
"73","8.614391","2404:6800:4009:81a::2004","2409:4089:2d0a:d410:19ac:9552:3acb:fb4b","TLSv1.3","702","Application Data"
"74","8.614391","2404:6800:4009:81a::2004","2409:4089:2d0a:d410:19ac:9552:3acb:fb4b","TCP","74","443  >  55777 [FIN, ACK] Seq=4289 Ack=519 Win=66816 Len=0"
"75","8.614451","2409:4089:2d0a:d410:19ac:9552:3acb:fb4b","2404:6800:4009:81a::2004","TCP","74","55777  >  443 [RST, ACK] Seq=519 Ack=1221 Win=0 Len=0"
"76","8.957842","192.168.144.139","192.168.144.105","DNS","82","Standard query 0xe2e7 AAAA www.rollingstone.co.uk"
"77","9.020527","192.168.144.139","192.168.144.105","DNS","82","Standard query 0xe2e7 AAAA www.rollingstone.co.uk"
"78","9.067686","192.168.144.105","192.168.144.139","DNS","145","Standard query response 0xe2e7 AAAA www.rollingstone.co.uk CNAME pugpig.map.fastly.net AAAA 2a04:4e42:42::328"
"79","9.068748","192.168.144.139","192.168.144.105","DNS","81","Standard query 0x060b AAAA pugpig.map.fastly.net"
"80","9.075150","192.168.144.105","192.168.144.139","DNS","109","Standard query response 0x060b AAAA pugpig.map.fastly.net AAAA 2a04:4e42:42::328"
"81","10.006284","2409:4089:2d0a:d410:19ac:9552:3acb:fb4b","2600:1901:0:38d7::","TCP","75","[TCP Spurious Retransmission] 55739  >  80 [ACK] Seq=0 Ack=1 Win=512 Len=1"
"82","10.150288","192.168.144.139","34.107.221.82","TCP","55","[TCP Keep-Alive] 55742  >  80 [ACK] Seq=1 Ack=1 Win=512 Len=1"
"83","10.157576","2600:1901:0:38d7::","2409:4089:2d0a:d410:19ac:9552:3acb:fb4b","TCP","86","[TCP Dup ACK 1#1] 80  >  55739 [ACK] Seq=1 Ack=1 Win=261 Len=0 SLE=0 SRE=1"
"84","10.211383","2409:4089:2d0a:d410:19ac:9552:3acb:fb4b","2600:1901:0:38d7::","TCP","75","[TCP Keep-Alive] 55743  >  80 [ACK] Seq=1 Ack=1 Win=512 Len=1"
"85","10.233336","34.107.221.82","192.168.144.139","TCP","66","[TCP Keep-Alive ACK] 80  >  55742 [ACK] Seq=1 Ack=2 Win=261 Len=0 SLE=1 SRE=2"
"86","10.273579","192.168.144.139","34.107.221.82","HTTP","359","GET /success.txt?ipv4 HTTP/1.1 "
"87","10.296448","2600:1901:0:38d7::","2409:4089:2d0a:d410:19ac:9552:3acb:fb4b","TCP","86","[TCP Keep-Alive ACK] 80  >  55743 [ACK] Seq=1 Ack=2 Win=261 Len=0 SLE=1 SRE=2"
"88","10.610396","192.168.144.139","192.168.144.105","DNS","86","Standard query 0x0866 A encrypted-tbn0.gstatic.com"
"89","10.610396","192.168.144.139","192.168.144.105","DNS","75","Standard query 0x2fec A www.gstatic.com"
"90","10.610682","192.168.144.139","192.168.144.105","DNS","75","Standard query 0x375d AAAA www.gstatic.com"
"91","10.612292","192.168.144.139","192.168.144.105","DNS","86","Standard query 0x4242 AAAA encrypted-tbn0.gstatic.com"
"92","10.619470","2409:4089:2d0a:d410:19ac:9552:3acb:fb4b","2404:6800:4009:81a::2004","TCP","86","55778  >  443 [SYN] Seq=0 Win=64952 Len=0 MSS=1412 WS=256 SACK_PERM"
"93","10.679122","192.168.144.139","192.168.144.105","DNS","75","Standard query 0x375d AAAA www.gstatic.com"
"94","10.679123","192.168.144.139","192.168.144.105","DNS","75","Standard query 0x2fec A www.gstatic.com"
"95","10.679123","192.168.144.139","192.168.144.105","DNS","86","Standard query 0x0866 A encrypted-tbn0.gstatic.com"
"96","10.679153","192.168.144.139","192.168.144.105","DNS","86","Standard query 0x4242 AAAA encrypted-tbn0.gstatic.com"
"97","10.733329","192.168.144.105","192.168.144.139","DNS","103","Standard query response 0x375d AAAA www.gstatic.com AAAA 2404:6800:4002:81f::2003"
"98","10.733329","192.168.144.105","192.168.144.139","DNS","102","Standard query response 0x0866 A encrypted-tbn0.gstatic.com A 142.250.206.142"
"99","10.739482","192.168.144.105","192.168.144.139","DNS","91","Standard query response 0x2fec A www.gstatic.com A 142.250.194.35"
"100","10.739482","192.168.144.105","192.168.144.139","DNS","114","Standard query response 0x4242 AAAA encrypted-tbn0.gstatic.com AAAA 2404:6800:4002:81a::200e"
"101","10.740357","192.168.144.139","192.168.144.105","DNS","75","Standard query 0xba82 A www.gstatic.com"
"102","10.740358","192.168.144.139","192.168.144.105","DNS","86","Standard query 0x2e47 A encrypted-tbn0.gstatic.com"
"103","10.743786","192.168.144.105","192.168.144.139","DNS","91","Standard query response 0xba82 A www.gstatic.com A 142.250.194.35"
"104","10.743786","192.168.144.105","192.168.144.139","DNS","102","Standard query response 0x2e47 A encrypted-tbn0.gstatic.com A 142.250.206.142"
"105","10.744552","192.168.144.139","192.168.144.105","DNS","75","Standard query 0xf894 AAAA www.gstatic.com"
"106","10.744553","192.168.144.139","192.168.144.105","DNS","86","Standard query 0x424a AAAA encrypted-tbn0.gstatic.com"
"107","10.753492","192.168.144.105","192.168.144.139","DNS","103","Standard query response 0xf894 AAAA www.gstatic.com AAAA 2404:6800:4002:81f::2003"
"108","10.753492","192.168.144.105","192.168.144.139","DNS","114","Standard query response 0x424a AAAA encrypted-tbn0.gstatic.com AAAA 2404:6800:4002:81a::200e"
"109","10.771106","2404:6800:4009:81a::2004","2409:4089:2d0a:d410:19ac:9552:3acb:fb4b","TCP","86","443  >  55778 [SYN, ACK] Seq=0 Ack=1 Win=65535 Len=0 MSS=1370 SACK_PERM WS=256"
"110","10.771315","2409:4089:2d0a:d410:19ac:9552:3acb:fb4b","2404:6800:4009:81a::2004","TCP","74","55778  >  443 [ACK] Seq=1 Ack=1 Win=131328 Len=0"
"111","10.772467","2409:4089:2d0a:d410:19ac:9552:3acb:fb4b","2405:200:1630:a0b::312c:c4b3","TCP","75","[TCP Keep-Alive] 55746  >  80 [ACK] Seq=1 Ack=1 Win=510 Len=1"
"112","10.773340","2409:4089:2d0a:d410:19ac:9552:3acb:fb4b","2404:6800:4009:81a::2004","TLSv1.3","591","Client Hello"
"113","10.837402","2405:200:1630:a0b::312c:c4b3","2409:4089:2d0a:d410:19ac:9552:3acb:fb4b","TCP","86","[TCP Keep-Alive ACK] 80  >  55746 [ACK] Seq=1 Ack=2 Win=501 Len=0 SLE=1 SRE=2"
"114","10.890313","2404:6800:4009:81a::2004","2409:4089:2d0a:d410:19ac:9552:3acb:fb4b","TCP","74","443  >  55778 [ACK] Seq=1 Ack=518 Win=66816 Len=0"
"115","10.950189","2404:6800:4009:81a::2004","2409:4089:2d0a:d410:19ac:9552:3acb:fb4b","TLSv1.3","1294","Server Hello, Change Cipher Spec"
"116","10.950189","2404:6800:4009:81a::2004","2409:4089:2d0a:d410:19ac:9552:3acb:fb4b","TCP","1294","443  >  55778 [PSH, ACK] Seq=1221 Ack=518 Win=66816 Len=1220 [TCP segment of a reassembled PDU]"
"117","10.950254","2409:4089:2d0a:d410:19ac:9552:3acb:fb4b","2404:6800:4009:81a::2004","TCP","74","55778  >  443 [ACK] Seq=518 Ack=2441 Win=131328 Len=0"
"118","10.951337","2404:6800:4009:81a::2004","2409:4089:2d0a:d410:19ac:9552:3acb:fb4b","TCP","1294","443  >  55778 [ACK] Seq=2441 Ack=518 Win=66816 Len=1220 [TCP segment of a reassembled PDU]"
"119","10.958392","2404:6800:4009:81a::2004","2409:4089:2d0a:d410:19ac:9552:3acb:fb4b","TLSv1.3","701","Application Data"
"120","10.958485","2409:4089:2d0a:d410:19ac:9552:3acb:fb4b","2404:6800:4009:81a::2004","TCP","74","55778  >  443 [ACK] Seq=518 Ack=4288 Win=131328 Len=0"
"121","10.972228","2409:4089:2d0a:d410:19ac:9552:3acb:fb4b","2404:6800:4009:80a::2003","OCSP","502","Request"
"122","11.075103","2404:6800:4009:80a::2003","2409:4089:2d0a:d410:19ac:9552:3acb:fb4b","TCP","74","80  >  55773 [ACK] Seq=1 Ack=430 Win=265 Len=0"
"123","11.135876","2404:6800:4009:80a::2003","2409:4089:2d0a:d410:19ac:9552:3acb:fb4b","OCSP","775","Response"
"124","11.136890","2409:4089:2d0a:d410:19ac:9552:3acb:fb4b","2404:6800:4009:81a::2004","TLSv1.3","138","Change Cipher Spec, Application Data"
"125","11.137398","2409:4089:2d0a:d410:19ac:9552:3acb:fb4b","2404:6800:4009:81a::2004","TLSv1.3","244","Application Data"
"126","11.137424","2409:4089:2d0a:d410:19ac:9552:3acb:fb4b","2404:6800:4009:81a::2004","TCP","1444","55778  >  443 [ACK] Seq=752 Ack=4288 Win=131328 Len=1370 [TCP segment of a reassembled PDU]"
"127","11.137424","2409:4089:2d0a:d410:19ac:9552:3acb:fb4b","2404:6800:4009:81a::2004","TLSv1.3","159","Application Data"
"128","11.163576","2409:4089:2d0a:d410:19ac:9552:3acb:fb4b","2404:6800:4009:80a::2003","TCP","75","[TCP Keep-Alive] 55762  >  80 [ACK] Seq=1 Ack=1 Win=511 Len=1"
"129","11.179794","2409:4089:2d0a:d410:19ac:9552:3acb:fb4b","2404:6800:4009:80a::2003","TCP","74","55773  >  80 [ACK] Seq=430 Ack=702 Win=513 Len=0"
"130","11.264342","2404:6800:4009:80a::2003","2409:4089:2d0a:d410:19ac:9552:3acb:fb4b","TCP","86","[TCP Keep-Alive ACK] 80  >  55762 [ACK] Seq=1 Ack=2 Win=261 Len=0 SLE=1 SRE=2"
"131","11.270692","2404:6800:4009:81a::2004","2409:4089:2d0a:d410:19ac:9552:3acb:fb4b","TCP","74","443  >  55778 [ACK] Seq=4288 Ack=582 Win=66816 Len=0"
"132","11.270692","2404:6800:4009:81a::2004","2409:4089:2d0a:d410:19ac:9552:3acb:fb4b","TCP","74","443  >  55778 [ACK] Seq=4288 Ack=752 Win=67840 Len=0"
"133","11.274403","2404:6800:4009:81a::2004","2409:4089:2d0a:d410:19ac:9552:3acb:fb4b","TCP","74","443  >  55778 [ACK] Seq=4288 Ack=2122 Win=70656 Len=0"
"134","11.274403","2404:6800:4009:81a::2004","2409:4089:2d0a:d410:19ac:9552:3acb:fb4b","TLSv1.3","688","Application Data, Application Data"
"135","11.274403","2404:6800:4009:81a::2004","2409:4089:2d0a:d410:19ac:9552:3acb:fb4b","TLSv1.3","105","Application Data"
"136","11.274466","2409:4089:2d0a:d410:19ac:9552:3acb:fb4b","2404:6800:4009:81a::2004","TCP","74","55778  >  443 [ACK] Seq=2207 Ack=4933 Win=130816 Len=0"
"137","11.277301","2409:4089:2d0a:d410:19ac:9552:3acb:fb4b","2404:6800:4009:81a::2004","TLSv1.3","105","Application Data"
"138","11.282154","2404:6800:4009:81a::2004","2409:4089:2d0a:d410:19ac:9552:3acb:fb4b","TCP","74","443  >  55778 [ACK] Seq=4933 Ack=2207 Win=70656 Len=0"
"139","11.288436","2409:4089:2d0a:d410:19ac:9552:3acb:fb4b","64:ff9b::98c3:264c","TCP","75","[TCP Keep-Alive] 55769  >  80 [ACK] Seq=1 Ack=1 Win=510 Len=1"
"140","11.288436","2409:4089:2d0a:d410:19ac:9552:3acb:fb4b","64:ff9b::98c3:264c","TCP","75","[TCP Keep-Alive] 55768  >  80 [ACK] Seq=1 Ack=1 Win=510 Len=1"
"141","11.371962","64:ff9b::98c3:264c","2409:4089:2d0a:d410:19ac:9552:3acb:fb4b","TCP","86","[TCP Keep-Alive ACK] 80  >  55768 [ACK] Seq=1 Ack=2 Win=131 Len=0 SLE=1 SRE=2"
"142","11.371962","64:ff9b::98c3:264c","2409:4089:2d0a:d410:19ac:9552:3acb:fb4b","TCP","86","[TCP Keep-Alive ACK] 80  >  55769 [ACK] Seq=1 Ack=2 Win=131 Len=0 SLE=1 SRE=2"
"143","11.381579","2409:4089:2d0a:d410:19ac:9552:3acb:fb4b","64:ff9b::98c3:264c","TCP","75","[TCP Keep-Alive] 55765  >  80 [ACK] Seq=1 Ack=1 Win=513 Len=1"
"144","11.383674","2404:6800:4009:81a::2004","2409:4089:2d0a:d410:19ac:9552:3acb:fb4b","TCP","74","443  >  55778 [ACK] Seq=4933 Ack=2238 Win=70656 Len=0"
"145","11.397501","2409:4089:2d0a:d410:19ac:9552:3acb:fb4b","2405:200:1630:a0b::312c:c4b3","TCP","75","[TCP Keep-Alive] 55745  >  80 [ACK] Seq=1 Ack=1 Win=513 Len=1"
"146","11.463113","64:ff9b::98c3:264c","2409:4089:2d0a:d410:19ac:9552:3acb:fb4b","TCP","86","[TCP Keep-Alive ACK] 80  >  55765 [ACK] Seq=1 Ack=2 Win=133 Len=0 SLE=1 SRE=2"
"147","11.467332","2405:200:1630:a0b::312c:c4b3","2409:4089:2d0a:d410:19ac:9552:3acb:fb4b","TCP","86","[TCP Keep-Alive ACK] 80  >  55745 [ACK] Seq=1 Ack=2 Win=501 Len=0 SLE=1 SRE=2"
"148","11.494626","2404:6800:4009:81a::2004","2409:4089:2d0a:d410:19ac:9552:3acb:fb4b","TLSv1.3","1192","Application Data"
"149","11.494626","2404:6800:4009:81a::2004","2409:4089:2d0a:d410:19ac:9552:3acb:fb4b","TLSv1.3","1294","Application Data"
"150","11.494677","2409:4089:2d0a:d410:19ac:9552:3acb:fb4b","2404:6800:4009:81a::2004","TCP","74","55778  >  443 [ACK] Seq=2238 Ack=7271 Win=131328 Len=0"
"151","11.500277","2409:4089:2d0a:d410:19ac:9552:3acb:fb4b","2404:6800:4009:81a::2004","QUIC","1399","Initial, DCID=89f4574da0f77679, SCID=7d1bf0, PKN: 0, CRYPTO"
"152","11.506556","2404:6800:4009:81a::2004","2409:4089:2d0a:d410:19ac:9552:3acb:fb4b","TLSv1.3","1294","Application Data"
"153","11.506556","2404:6800:4009:81a::2004","2409:4089:2d0a:d410:19ac:9552:3acb:fb4b","TLSv1.3","1294","Application Data"
"154","11.506621","2409:4089:2d0a:d410:19ac:9552:3acb:fb4b","2404:6800:4009:81a::2004","TCP","74","55778  >  443 [ACK] Seq=2238 Ack=9711 Win=131328 Len=0"
"155","11.506827","2404:6800:4009:81a::2004","2409:4089:2d0a:d410:19ac:9552:3acb:fb4b","TLSv1.3","1294","Application Data"
"156","11.506827","2404:6800:4009:81a::2004","2409:4089:2d0a:d410:19ac:9552:3acb:fb4b","TLSv1.3","788","Application Data, Application Data"
"157","11.506872","2409:4089:2d0a:d410:19ac:9552:3acb:fb4b","2404:6800:4009:81a::2004","TCP","74","55778  >  443 [ACK] Seq=2238 Ack=11645 Win=131328 Len=0"
"158","11.510273","192.168.144.139","192.168.144.105","DNS","79","Standard query 0x2ee5 A www.cntraveller.com"
"159","11.510273","192.168.144.139","192.168.144.105","DNS","71","Standard query 0x5e9d A www.bbc.com"
"160","11.510915","192.168.144.139","192.168.144.105","DNS","71","Standard query 0x2661 AAAA www.bbc.com"
"161","11.559284","2409:4089:2d0a:d410:19ac:9552:3acb:fb4b","64:ff9b::2278:d07b","TLSv1.2","232","Application Data"
"162","11.559377","2409:4089:2d0a:d410:19ac:9552:3acb:fb4b","64:ff9b::2278:d07b","TLSv1.2","576","Application Data"
"163","11.559645","2409:4089:2d0a:d410:19ac:9552:3acb:fb4b","64:ff9b::2278:d07b","TLSv1.2","207","Application Data"
"164","11.559694","2409:4089:2d0a:d410:19ac:9552:3acb:fb4b","64:ff9b::2278:d07b","TLSv1.2","500","Application Data"
"165","11.559962","2409:4089:2d0a:d410:19ac:9552:3acb:fb4b","64:ff9b::2278:d07b","TLSv1.2","201","Application Data"
"166","11.559999","2409:4089:2d0a:d410:19ac:9552:3acb:fb4b","64:ff9b::2278:d07b","TLSv1.2","650","Application Data"
"167","11.568182","2409:4089:2d0a:d410:19ac:9552:3acb:fb4b","64:ff9b::2278:d07b","TLSv1.2","204","Application Data"
"168","11.568238","2409:4089:2d0a:d410:19ac:9552:3acb:fb4b","64:ff9b::2278:d07b","TLSv1.2","949","Application Data"
"169","11.583506","192.168.144.139","192.168.144.105","DNS","71","Standard query 0x2661 AAAA www.bbc.com"
"170","11.583506","192.168.144.139","192.168.144.105","DNS","79","Standard query 0x2ee5 A www.cntraveller.com"
"171","11.583506","192.168.144.139","192.168.144.105","DNS","71","Standard query 0x5e9d A www.bbc.com"
"172","11.593627","2404:6800:4009:81a::2004","2409:4089:2d0a:d410:19ac:9552:3acb:fb4b","TLSv1.3","1294","Application Data"
"173","11.593627","2404:6800:4009:81a::2004","2409:4089:2d0a:d410:19ac:9552:3acb:fb4b","TLSv1.3","1294","Application Data"
"174","11.593627","2404:6800:4009:81a::2004","2409:4089:2d0a:d410:19ac:9552:3acb:fb4b","TLSv1.3","1294","Application Data"
"175","11.593627","2404:6800:4009:81a::2004","2409:4089:2d0a:d410:19ac:9552:3acb:fb4b","TLSv1.3","1294","Application Data"
"176","11.593746","2409:4089:2d0a:d410:19ac:9552:3acb:fb4b","2404:6800:4009:81a::2004","TCP","74","55778  >  443 [ACK] Seq=2238 Ack=16525 Win=131328 Len=0"
"177","11.615110","2404:6800:4009:81a::2004","2409:4089:2d0a:d410:19ac:9552:3acb:fb4b","TLSv1.3","1294","Application Data"
"178","11.615110","2404:6800:4009:81a::2004","2409:4089:2d0a:d410:19ac:9552:3acb:fb4b","TLSv1.3","1294","Application Data"
"179","11.615110","2404:6800:4009:81a::2004","2409:4089:2d0a:d410:19ac:9552:3acb:fb4b","TLSv1.3","1294","Application Data"
"180","11.615199","2409:4089:2d0a:d410:19ac:9552:3acb:fb4b","2404:6800:4009:81a::2004","TCP","74","55778  >  443 [ACK] Seq=2238 Ack=20185 Win=131328 Len=0"
"181","11.658622","2404:6800:4009:81a::2004","2409:4089:2d0a:d410:19ac:9552:3acb:fb4b","TLSv1.3","1294","Application Data"
"182","11.658696","2409:4089:2d0a:d410:19ac:9552:3acb:fb4b","2404:6800:4009:81a::2004","TCP","74","55778  >  443 [ACK] Seq=2238 Ack=21405 Win=130048 Len=0"
"183","11.659641","2404:6800:4009:81a::2004","2409:4089:2d0a:d410:19ac:9552:3acb:fb4b","TLSv1.3","1294","Application Data"
"184","11.697984","2404:6800:4009:81a::2004","2409:4089:2d0a:d410:19ac:9552:3acb:fb4b","TLSv1.3","1294","Application Data"
"185","11.698063","2409:4089:2d0a:d410:19ac:9552:3acb:fb4b","2404:6800:4009:81a::2004","TCP","74","55778  >  443 [ACK] Seq=2238 Ack=23845 Win=131328 Len=0"
"186","11.699557","2404:6800:4009:81a::2004","2409:4089:2d0a:d410:19ac:9552:3acb:fb4b","TLSv1.3","1294","Application Data"
"187","11.714793","2404:6800:4009:81a::2004","2409:4089:2d0a:d410:19ac:9552:3acb:fb4b","TLSv1.3","1294","Application Data"
"188","11.714870","2409:4089:2d0a:d410:19ac:9552:3acb:fb4b","2404:6800:4009:81a::2004","TCP","74","55778  >  443 [ACK] Seq=2238 Ack=26285 Win=131328 Len=0"
"189","11.720345","2404:6800:4009:81a::2004","2409:4089:2d0a:d410:19ac:9552:3acb:fb4b","TLSv1.3","1294","Application Data"
"190","11.720919","2404:6800:4009:81a::2004","2409:4089:2d0a:d410:19ac:9552:3acb:fb4b","TLSv1.3","915","Application Data"
"191","11.720953","2409:4089:2d0a:d410:19ac:9552:3acb:fb4b","2404:6800:4009:81a::2004","TCP","74","55778  >  443 [ACK] Seq=2238 Ack=28346 Win=131328 Len=0"
"192","11.721606","2404:6800:4009:81a::2004","2409:4089:2d0a:d410:19ac:9552:3acb:fb4b","TLSv1.3","1294","Application Data"
"193","11.721848","2404:6800:4009:81a::2004","2409:4089:2d0a:d410:19ac:9552:3acb:fb4b","TLSv1.3","1294","Application Data"
"194","11.721881","2409:4089:2d0a:d410:19ac:9552:3acb:fb4b","2404:6800:4009:81a::2004","TCP","74","55778  >  443 [ACK] Seq=2238 Ack=30786 Win=131328 Len=0"
"195","11.722129","2404:6800:4009:81a::2004","2409:4089:2d0a:d410:19ac:9552:3acb:fb4b","TLSv1.3","1294","Application Data"
"196","11.722597","2404:6800:4009:81a::2004","2409:4089:2d0a:d410:19ac:9552:3acb:fb4b","TLSv1.3","1294","Application Data"
"197","11.722641","2409:4089:2d0a:d410:19ac:9552:3acb:fb4b","2404:6800:4009:81a::2004","TCP","74","55778  >  443 [ACK] Seq=2238 Ack=33226 Win=131328 Len=0"
"198","11.722874","2404:6800:4009:81a::2004","2409:4089:2d0a:d410:19ac:9552:3acb:fb4b","TLSv1.3","1294","Application Data"
"199","11.723109","2404:6800:4009:81a::2004","2409:4089:2d0a:d410:19ac:9552:3acb:fb4b","TLSv1.3","1294","Application Data"
"200","11.723137","2409:4089:2d0a:d410:19ac:9552:3acb:fb4b","2404:6800:4009:81a::2004","TCP","74","55778  >  443 [ACK] Seq=2238 Ack=35666 Win=131328 Len=0"
"201","11.723628","2404:6800:4009:81a::2004","2409:4089:2d0a:d410:19ac:9552:3acb:fb4b","TLSv1.3","1294","Application Data"
"202","11.727732","192.168.144.139","192.168.144.105","DNS","85","Standard query 0x273a A lh3.googleusercontent.com"
"203","11.728114","192.168.144.139","192.168.144.105","DNS","85","Standard query 0x2a77 AAAA lh3.googleusercontent.com"
"204","11.728414","2404:6800:4009:81a::2004","2409:4089:2d0a:d410:19ac:9552:3acb:fb4b","QUIC","1399","Initial, DCID=7d1bf0, SCID=c9f4574da0f77679, PKN: 1, ACK, CRYPTO, PADDING"
"205","11.728414","192.168.144.105","192.168.144.139","DNS","145","Standard query response 0x2ee5 A www.cntraveller.com CNAME dualstack.cni-digital.map.fastly.net A 199.232.22.133"
"206","11.729301","2409:4089:2d0a:d410:19ac:9552:3acb:fb4b","2404:6800:4009:81a::2004","QUIC","102","Handshake, DCID=c9f4574da0f77679, SCID=7d1bf0"
"207","11.729542","192.168.144.139","192.168.144.105","DNS","96","Standard query 0x97b3 AAAA dualstack.cni-digital.map.fastly.net"
"208","11.731864","192.168.144.105","192.168.144.139","DNS","149","Standard query response 0x5e9d A www.bbc.com CNAME www.bbc.com.pri.bbc.com CNAME bbc.map.fastly.net A 199.232.20.81"
"209","11.733715","2404:6800:4009:81a::2004","2409:4089:2d0a:d410:19ac:9552:3acb:fb4b","TLSv1.3","1294","Application Data"
"210","11.733715","2404:6800:4009:81a::2004","2409:4089:2d0a:d410:19ac:9552:3acb:fb4b","TLSv1.3","1294","Application Data"
"211","11.733715","2404:6800:4009:81a::2004","2409:4089:2d0a:d410:19ac:9552:3acb:fb4b","TLSv1.3","1294","Application Data"
"212","11.733715","2404:6800:4009:81a::2004","2409:4089:2d0a:d410:19ac:9552:3acb:fb4b","TLSv1.3","1294","Application Data"
"213","11.733768","2409:4089:2d0a:d410:19ac:9552:3acb:fb4b","2404:6800:4009:81a::2004","TCP","74","55778  >  443 [ACK] Seq=2238 Ack=41766 Win=131328 Len=0"
"214","11.735448","2409:4089:2d0a:d410:19ac:9552:3acb:fb4b","2404:6800:4009:81a::2004","TLSv1.3","499","Application Data"
"215","11.739985","192.168.144.105","192.168.144.139","DNS","124","Standard query response 0x97b3 AAAA dualstack.cni-digital.map.fastly.net AAAA 2a04:4e42:42::645"
"216","11.740057","2409:4089:2d0a:d410:19ac:9552:3acb:fb4b","2404:6800:4009:81a::2004","TLSv1.3","109","Application Data"
"217","11.751685","2409:4089:2d0a:d410:19ac:9552:3acb:fb4b","2404:6800:4002:81f::2003","TCP","86","55779  >  443 [SYN] Seq=0 Win=64952 Len=0 MSS=1412 WS=256 SACK_PERM"
"218","11.752672","2409:4089:2d0a:d410:19ac:9552:3acb:fb4b","2404:6800:4002:81f::2003","TCP","86","55780  >  443 [SYN] Seq=0 Win=64952 Len=0 MSS=1412 WS=256 SACK_PERM"
"219","11.792245","2404:6800:4009:81a::2004","2409:4089:2d0a:d410:19ac:9552:3acb:fb4b","TLSv1.3","1294","Application Data"
"220","11.792473","2404:6800:4009:81a::2004","2409:4089:2d0a:d410:19ac:9552:3acb:fb4b","TLSv1.3","1294","Application Data"
"221","11.792499","2409:4089:2d0a:d410:19ac:9552:3acb:fb4b","2404:6800:4009:81a::2004","TCP","74","55778  >  443 [ACK] Seq=2698 Ack=44206 Win=131328 Len=0"
"222","11.802757","192.168.144.139","192.168.144.105","DNS","85","Standard query 0x2a77 AAAA lh3.googleusercontent.com"
"223","11.802757","192.168.144.139","192.168.144.105","DNS","85","Standard query 0x273a A lh3.googleusercontent.com"
"224","11.825918","2404:6800:4009:81a::2004","2409:4089:2d0a:d410:19ac:9552:3acb:fb4b","TLSv1.3","1294","Application Data"
"225","11.825918","64:ff9b::2278:d07b","2409:4089:2d0a:d410:19ac:9552:3acb:fb4b","TCP","74","443  >  55759 [ACK] Seq=1 Ack=159 Win=362 Len=0"
"226","11.826035","2404:6800:4009:81a::2004","2409:4089:2d0a:d410:19ac:9552:3acb:fb4b","TLSv1.3","1294","Application Data"
"227","11.826035","2404:6800:4009:81a::2004","2409:4089:2d0a:d410:19ac:9552:3acb:fb4b","TLSv1.3","437","Application Data, Application Data, Application Data"
"228","11.826073","2409:4089:2d0a:d410:19ac:9552:3acb:fb4b","2404:6800:4009:81a::2004","TCP","74","55778  >  443 [ACK] Seq=2698 Ack=47009 Win=131328 Len=0"
"229","11.826340","2409:4089:2d0a:d410:19ac:9552:3acb:fb4b","2404:6800:4009:81a::2004","TLSv1.3","113","Application Data"
"230","11.826345","2404:6800:4009:81a::2004","2409:4089:2d0a:d410:19ac:9552:3acb:fb4b","QUIC","1399","Handshake, DCID=7d1bf0, SCID=c9f4574da0f77679"
"231","11.826619","2409:4089:2d0a:d410:19ac:9552:3acb:fb4b","2404:6800:4009:81a::2004","QUIC","104","Handshake, DCID=c9f4574da0f77679, SCID=7d1bf0"
"232","11.873948","2409:4089:2d0a:d410:19ac:9552:3acb:fb4b","2404:6800:4009:81a::2004","TLSv1.3","331","Application Data"
"233","11.874209","2409:4089:2d0a:d410:19ac:9552:3acb:fb4b","2404:6800:4009:81a::2004","TLSv1.3","105","Application Data"
"234","11.875308","192.168.144.139","192.168.144.105","DNS","75","Standard query 0x6f2a A apis.google.com"
"235","11.875680","192.168.144.139","192.168.144.105","DNS","75","Standard query 0x867d AAAA apis.google.com"
"236","11.883062","2404:6800:4009:81a::2004","2409:4089:2d0a:d410:19ac:9552:3acb:fb4b","QUIC","1399","Handshake, DCID=7d1bf0, SCID=c9f4574da0f77679"
"237","11.883062","64:ff9b::2278:d07b","2409:4089:2d0a:d410:19ac:9552:3acb:fb4b","TCP","74","443  >  55759 [ACK] Seq=1 Ack=661 Win=369 Len=0"
"238","11.883062","64:ff9b::2278:d07b","2409:4089:2d0a:d410:19ac:9552:3acb:fb4b","TCP","74","443  >  55759 [ACK] Seq=1 Ack=794 Win=377 Len=0"
"239","11.883062","64:ff9b::2278:d07b","2409:4089:2d0a:d410:19ac:9552:3acb:fb4b","TCP","74","443  >  55759 [ACK] Seq=1 Ack=1220 Win=385 Len=0"
"240","11.883062","64:ff9b::2278:d07b","2409:4089:2d0a:d410:19ac:9552:3acb:fb4b","TCP","74","443  >  55759 [ACK] Seq=1 Ack=1347 Win=385 Len=0"
"241","11.883476","2409:4089:2d0a:d410:19ac:9552:3acb:fb4b","2404:6800:4009:81a::2004","QUIC","104","Handshake, DCID=c9f4574da0f77679, SCID=7d1bf0"
"242","11.884342","64:ff9b::2278:d07b","2409:4089:2d0a:d410:19ac:9552:3acb:fb4b","TCP","74","443  >  55759 [ACK] Seq=1 Ack=1923 Win=392 Len=0"
"243","11.884524","64:ff9b::2278:d07b","2409:4089:2d0a:d410:19ac:9552:3acb:fb4b","TCP","74","443  >  55759 [ACK] Seq=1 Ack=2053 Win=400 Len=0"
"244","11.885805","192.168.144.139","192.168.144.105","DNS","73","Standard query 0xa2e9 A aa.google.com"
"245","11.886233","192.168.144.139","192.168.144.105","DNS","73","Standard query 0xb532 AAAA aa.google.com"
"246","11.887495","192.168.144.105","192.168.144.139","DNS","161","Standard query response 0x2661 AAAA www.bbc.com CNAME www.bbc.com.pri.bbc.com CNAME bbc.map.fastly.net AAAA 64:ff9b::c7e8:1451"
"247","11.888224","192.168.144.139","192.168.144.105","DNS","78","Standard query 0x818c A bbc.map.fastly.net"
"248","11.891867","192.168.144.105","192.168.144.139","DNS","94","Standard query response 0x818c A bbc.map.fastly.net A 199.232.20.81"
"249","11.892774","192.168.144.139","192.168.144.105","DNS","78","Standard query 0xdf11 AAAA bbc.map.fastly.net"
"250","11.898587","192.168.144.105","192.168.144.139","DNS","106","Standard query response 0xdf11 AAAA bbc.map.fastly.net AAAA 64:ff9b::c7e8:1451"
"251","11.927730","2409:4089:2d0a:d410:19ac:9552:3acb:fb4b","2405:200:1630:a0b::312c:c4b3","TCP","75","[TCP Keep-Alive] 55755  >  80 [ACK] Seq=1 Ack=1 Win=513 Len=1"
"252","11.937277","64:ff9b::2278:d07b","2409:4089:2d0a:d410:19ac:9552:3acb:fb4b","TCP","74","443  >  55759 [ACK] Seq=1 Ack=2928 Win=407 Len=0"
"253","11.943718","192.168.144.139","192.168.144.105","DNS","75","Standard query 0x6f2a A apis.google.com"
"254","11.943718","192.168.144.139","192.168.144.105","DNS","75","Standard query 0x867d AAAA apis.google.com"
"255","11.959921","192.168.144.139","192.168.144.105","DNS","73","Standard query 0xb532 AAAA aa.google.com"
"256","11.959923","192.168.144.139","192.168.144.105","DNS","73","Standard query 0xa2e9 A aa.google.com"
"257","11.968442","192.168.144.105","192.168.144.139","DNS","130","Standard query response 0x273a A lh3.googleusercontent.com CNAME googlehosted.l.googleusercontent.com A 142.250.194.161"
"258","11.968442","192.168.144.105","192.168.144.139","DNS","142","Standard query response 0x2a77 AAAA lh3.googleusercontent.com CNAME googlehosted.l.googleusercontent.com AAAA 2404:6800:4002:820::2001"
"259","11.969917","192.168.144.139","192.168.144.105","DNS","96","Standard query 0x4542 A googlehosted.l.googleusercontent.com"
"260","11.975021","192.168.144.105","192.168.144.139","DNS","112","Standard query response 0x4542 A googlehosted.l.googleusercontent.com A 142.250.194.161"
"261","11.975951","192.168.144.139","192.168.144.105","DNS","96","Standard query 0x86a6 AAAA googlehosted.l.googleusercontent.com"
"262","11.978670","192.168.144.105","192.168.144.139","DNS","124","Standard query response 0x86a6 AAAA googlehosted.l.googleusercontent.com AAAA 2404:6800:4002:820::2001"
"263","11.998229","2404:6800:4002:81f::2003","2409:4089:2d0a:d410:19ac:9552:3acb:fb4b","TCP","86","443  >  55780 [SYN, ACK] Seq=0 Ack=1 Win=65535 Len=0 MSS=1370 SACK_PERM WS=256"
"264","12.006592","2404:6800:4002:81f::2003","2409:4089:2d0a:d410:19ac:9552:3acb:fb4b","TCP","86","443  >  55779 [SYN, ACK] Seq=0 Ack=1 Win=65535 Len=0 MSS=1370 SACK_PERM WS=256"
"265","12.006592","2404:6800:4009:81a::2004","2409:4089:2d0a:d410:19ac:9552:3acb:fb4b","QUIC","1399","Handshake, DCID=7d1bf0, SCID=c9f4574da0f77679"
"266","12.006954","2409:4089:2d0a:d410:19ac:9552:3acb:fb4b","2404:6800:4009:81a::2004","QUIC","104","Handshake, DCID=c9f4574da0f77679, SCID=7d1bf0"
"267","12.007118","2404:6800:4009:81a::2004","2409:4089:2d0a:d410:19ac:9552:3acb:fb4b","QUIC","1399","Handshake, DCID=7d1bf0, SCID=c9f4574da0f77679"
"268","12.007118","2404:6800:4009:81a::2004","2409:4089:2d0a:d410:19ac:9552:3acb:fb4b","QUIC","1399","Handshake, DCID=7d1bf0, SCID=c9f4574da0f77679"
"269","12.007209","2404:6800:4009:81a::2004","2409:4089:2d0a:d410:19ac:9552:3acb:fb4b","QUIC","486","Protected Payload (KP0), DCID=7d1bf0"
"270","12.013296","2409:4089:2d0a:d410:19ac:9552:3acb:fb4b","2404:6800:4009:81a::2004","QUIC","105","Handshake, DCID=c9f4574da0f77679, SCID=7d1bf0"
"271","12.037733","2409:4089:2d0a:d410:19ac:9552:3acb:fb4b","2404:6800:4009:81a::2004","TCP","861","[TCP Retransmission] 55778  >  443 [PSH, ACK] Seq=2238 Ack=47009 Win=131328 Len=787"
"272","12.039744","2409:4089:2d0a:d410:19ac:9552:3acb:fb4b","2404:6800:4009:80a::2003","OCSP","502","Request"
"273","12.040699","2404:6800:4009:81a::2004","2409:4089:2d0a:d410:19ac:9552:3acb:fb4b","TCP","74","443  >  55778 [ACK] Seq=47009 Ack=2663 Win=73216 Len=0"
"274","12.040699","2404:6800:4009:81a::2004","2409:4089:2d0a:d410:19ac:9552:3acb:fb4b","TCP","74","443  >  55778 [ACK] Seq=47009 Ack=2698 Win=73216 Len=0"
"275","12.040738","2404:6800:4009:81a::2004","2409:4089:2d0a:d410:19ac:9552:3acb:fb4b","TCP","74","443  >  55778 [ACK] Seq=47009 Ack=2737 Win=73216 Len=0"
"276","12.041046","64:ff9b::2278:d07b","2409:4089:2d0a:d410:19ac:9552:3acb:fb4b","TLSv1.2","149","Application Data"
"277","12.041046","64:ff9b::2278:d07b","2409:4089:2d0a:d410:19ac:9552:3acb:fb4b","TLSv1.2","181","Application Data"
"278","12.041046","64:ff9b::2278:d07b","2409:4089:2d0a:d410:19ac:9552:3acb:fb4b","TLSv1.2","312","Application Data"
"279","12.041046","64:ff9b::2278:d07b","2409:4089:2d0a:d410:19ac:9552:3acb:fb4b","TLSv1.2","120","Application Data"
"280","12.041046","64:ff9b::2278:d07b","2409:4089:2d0a:d410:19ac:9552:3acb:fb4b","TLSv1.2","149","Application Data"
"281","12.041095","2409:4089:2d0a:d410:19ac:9552:3acb:fb4b","64:ff9b::2278:d07b","TCP","74","55759  >  443 [ACK] Seq=2928 Ack=542 Win=509 Len=0"
"282","12.041226","64:ff9b::2278:d07b","2409:4089:2d0a:d410:19ac:9552:3acb:fb4b","TLSv1.2","330","Application Data"
"283","12.041251","2409:4089:2d0a:d410:19ac:9552:3acb:fb4b","64:ff9b::2278:d07b","TCP","74","55759  >  443 [ACK] Seq=2928 Ack=798 Win=508 Len=0"
"284","12.041328","2409:4089:2d0a:d410:19ac:9552:3acb:fb4b","64:ff9b::2278:d07b","TLSv1.2","120","Application Data"
"285","12.041456","64:ff9b::2278:d07b","2409:4089:2d0a:d410:19ac:9552:3acb:fb4b","TLSv1.2","209","Application Data"
